id	bug_id	summary	description	report_time	report_timestamp	status	commit	commit_timestamp	files
63	189	Logging of GPU memory utilization can significantly slow down training	training using gpus pytorch lightning automatically log gpu memory utilization training useful feature severely impact performance dependent speed nvidia smi call particular cluster university scale hpc cluster based ibm lsf lead performance decrease almost fold training gpu v cpu describe bug logging gpu memory severe impact training performance remove gpu memory logging commenting line pytorch lightning model trainer py see expected behavior logging gpu memory utilization impede performance running nvidia smi call background least possible deactivate case performance issue arise desktop please complete following information os ubuntu linux nvidia geforce gtx	2019-09-03 15:48:23	1567525703	resolved fixed	dac41030d48acbfecdf7c083b8e7b00f3fd9be06	1567608226	docs\Trainer\Logging.md pytorch_lightning\models\trainer.py                                                                  
64	1898	batch size finder does not recognize flag and seems to download often	auto scale batch size flag requires string also work set true ie support case auto scale batch size seems trigger data downloads frequently files already downloaded verified files already downloaded verified files already downloaded verified files already downloaded verified files already downloaded verified files already downloaded verified batch size succeeded trying batch size files already downloaded verified	2020-05-20 04:02:38	1589947358	resolved fixed	a34eb9e169622fe91fdf4d98560b65b2f2b5c8d0	1590407036	CHANGELOG.md pytorch_lightning\trainer\trainer.py tests\trainer\test_lr_finder.py tests\trainer\test_trainer_tricks.py                                                              
65	1899	Incorrect number of batches when multiple test loaders are used and test_percent_check is specified	bug multiple test dataloaders test percent check specified estimated total batch incorrect progress bar show properly example specify two dataloaders batch test percent check expected total batch actually batch run line num batch global number batch assigned self num test batch pytorch lightning pytorch lightning trainer data loading py line num batch int num batch percent check evaluation loop max batch regarded number batch one data loader pytorch lightning pytorch lightning trainer evaluation loop py line batch idx max batch reproduce steps reproduce behavior return multiple dataloaders test dataloaders specify test percent check run trainer test observe expected batch num loader run progress bar also fails show progress expected batch exceeds specified total step expected behavior run correct number batch environment cuda gpu available false version packages numpy pytorch debug false pytorch version pytorch lightning tensorboard tqdm system os linux architecture processor python version smp debian	2020-05-20 06:25:58	1589955958	resolved fixed	e085e93dd303e80af2e9a5fe4aa392055c831114	1592925684	CHANGELOG.md pytorch_lightning\trainer\__init__.py pytorch_lightning\trainer\data_loading.py pytorch_lightning\trainer\evaluation_loop.py pytorch_lightning\trainer\trainer.py pytorch_lightning\trainer\training_loop.py tests\base\model_test_dataloaders.py tests\base\model_test_epoch_ends.py tests\base\model_utilities.py tests\base\model_valid_dataloaders.py tests\base\model_valid_epoch_ends.py tests\test_deprecated.py tests\trainer\test_dataloaders.py                                            
66	1916	Trainer.parse_argparser does not yield sensible default for default_root_dir	bug using trainer parse argparser return true default root dir however string expected reproduce steps reproduce behavior pytorch lightning import trainer argparse import argumentparser namespace parser argumentparser add help false parser trainer add argparse args parent parser parser args trainer parse argparser parser args namespace accumulate grad batch amp level o1 auto lr find false auto scale batch size false auto select gpus false benchmark false check val every n epoch checkpoint callback true default root dir true deterministic false distributed backend true early stop callback false fast dev run false gpus gradient clip val log gpu memory true log save interval logger true max epoch max step true min epoch min step true num node num process num sanity val step overfit pct precision print nan grad false process position profiler true progress bar callback true progress bar refresh rate reload dataloaders every epoch false replace sampler ddp true resume checkpoint true row log interval terminate nan false test percent check tpu core true track grad norm train percent check truncated bptt step true val check interval val percent check weight save path true weight summary full	2020-05-21 03:19:41	1590031181	resolved fixed	b3ebfec863df8513f42e7211a29f857139e8ede4	1594293030	pytorch_lightning\trainer\trainer.py tests\trainer\test_trainer_cli.py                                                                  
67	1937	"TODO list for ""replace Hparams by init args"" PR"	todo follow work module argument rework doc make clear multiple way args passed example class litmodel lightningmodule def init self arg1 arg2 trainer add argparse args parser litmodel add model specific args parser litmodel parser parse args fail work since list argument constructor fixed size fix two way add kwargs init signature catch unnecessary args good design work split parser separate model args trainer args doc make clear type save checkpoint nn module example name module argument maybe misleading believe args saved old code left commented including test mentioned yukw777 test model checkpointing changed thoroughly test correct args loaded test test case positional args bugfix fix super called called local var added e g class litmodel lightningmodule def init self arg1 arg2 local var super init module argument contains local var litmodel load checkpoint fails typeerror init got unexpected argument local var obviously want local var argument checkpoint bugfix python forced call instance self currently hardcoded lead class litmodel lightningmodule def init obj arg1 arg2 obj arg1 arg1 super init module argument contain litmodel applies conventional naming args kwargs test make sure lrfinder still work expected passing suggested learning rate argument fixed enhancement festeh want add support dataclasses bugfix example broken problem mentioned test multiple inheritance error warn self auto collect argument called somewhere init specific use case currently working feel free add additional bullet point missed	2020-05-24 23:28:26	1590362906	resolved fixed	4234992302608e1999c00b4faffac591fb537a34	1591274150	CHANGELOG.md pytorch_lightning\core\lightning.py tests\models\test_hparams.py                                                                
68	195	Non plain-tensor batches	hello trying use lightning train graph neural network built torch geometric package using gpu error get try fit model miniconda3 envs pyg lib python3 site package torch geometric nn conv gcn conv py forward self x edge index edge weight def forward self x edge index edge weight none x torch matmul x self weight self cached self cached result none runtimeerror expected object backend cpu got backend cuda argument mat2 investigated code lightning probable cause found transfer batch gpu cause error current behavior function considers batch either plain simple collection object list dict tuple problem torch geometric us custom aggregate type doc implement method implement believe would nice could make code flexible process case similar case general correctly believe best solution replace isinstance batch torch tensor condition batch object either cuda method implemented solve problem general	2019-09-04 13:13:13	1567602793	resolved fixed	34b824a9d3d0fdd377da675e0398c66ab5e16e7b	1567681986	pytorch_lightning\models\trainer.py                                                                    
69	2027	Support DictConfig	need add dictconfig support omegaconf borda auto hparam save	2020-05-31 12:33:44	1590928424	resolved fixed	d2967d9305b42c9260f821f2b7fb43fbf19ca1aa	1591615174	CHANGELOG.md docs\source\hyperparameters.rst pytorch_lightning\core\lightning.py pytorch_lightning\core\saving.py pytorch_lightning\trainer\trainer.py pytorch_lightning\trainer\training_io.py pytorch_lightning\utilities\__init__.py pytorch_lightning\utilities\parsing.py tests\base\model_template.py tests\loggers\test_trains.py tests\models\test_cpu.py tests\models\test_hparams.py tests\models\test_restore.py tests\requirements-devel.txt tests\trainer\test_trainer.py                                        
70	2058	Hydra MLFlow Clash	bug using mlflow logger hydra parameter passed lightningmodule dictconfig condition logger base py met pytorch lightning pytorch lightning logger base py line isinstance input dict dict reproduce use hydra mlflow together traceback recent call last file home siavash kronikare kwae2 kwae model pl train segmentation model py line main file home siavash anaconda3 envs kwae lib python3 site package hydra main py line decorated main strict strict file home siavash anaconda3 envs kwae lib python3 site package hydra internal utils py line run hydra override args override file home siavash anaconda3 envs kwae lib python3 site package hydra internal hydra py line run job subdir key none file home siavash anaconda3 envs kwae lib python3 site package hydra plugins common utils py line run job ret return value task function task cfg file home siavash kronikare kwae2 kwae model pl train segmentation model py line main trainer fit wound seg pl file home siavash anaconda3 envs kwae lib python3 site package pytorch lightning trainer trainer py line fit self single gpu train model file home siavash anaconda3 envs kwae lib python3 site package pytorch lightning trainer distrib part py line single gpu train self run pretrain routine model file home siavash anaconda3 envs kwae lib python3 site package pytorch lightning trainer trainer py line run pretrain routine self logger log hyperparams ref model hparams file home siavash anaconda3 envs kwae lib python3 site package pytorch lightning logger base py line log hyperparams logger log hyperparams params logger self logger iterable file home siavash anaconda3 envs kwae lib python3 site package pytorch lightning logger base py line logger log hyperparams params logger self logger iterable file home siavash anaconda3 envs kwae lib python3 site package pytorch lightning utility distributed py line wrapped fn return fn args kwargs file home siavash anaconda3 envs kwae lib python3 site package pytorch lightning logger mlflow py line log hyperparams self experiment log param self run id k v file home siavash anaconda3 envs kwae lib python3 site package mlflow tracking client py line log param self tracking client log param run id key value file home siavash anaconda3 envs kwae lib python3 site package mlflow tracking tracking service client py line log param validate param name key file home siavash anaconda3 envs kwae lib python3 site package mlflow utils validation py line validate param name invalid parameter value mlflow exception mlflowexception invalid parameter name names may treated file certain case must resolve name treated name would resolve expected behavior check whether instance dict dictconfig given line	2020-06-03 08:16:37	1591172197	resolved fixed	44385bb582467acaa35cd4da553b2343a7860598	1592925644	pytorch_lightning\loggers\base.py                                                                    
71	2092	[ddp] New ddp implementation doesn't work in notebooks / using scripts	using spawn spin subprocesses ddp problem everything need picklable work well num worker dataloaders spawn fit model train model subprocess original model updated limitation lightning pytorch python result removed spawn instead call script hood approach solves problem assumes call model like python train py support way calling script decide support ddp jupyter notebook	2020-06-05 20:33:09	1591389189	resolved fixed	3260e59b2723a0f5d666c6779486717aa3a9373d	1591653325	docs\source\multi_gpu.rst pytorch_lightning\trainer\data_loading.py pytorch_lightning\trainer\distrib_data_parallel.py pytorch_lightning\trainer\trainer.py                                                              
72	2131	wandLogger().name is None in DDP mode	remove line everything work ddp mode issue	2020-06-09 15:01:43	1591714903	resolved fixed	145670f893f43ff70866668cf087d82fe51a22a6	1593554956	pytorch_lightning\callbacks\model_checkpoint.py pytorch_lightning\loggers\base.py pytorch_lightning\loggers\comet.py pytorch_lightning\loggers\mlflow.py pytorch_lightning\loggers\neptune.py pytorch_lightning\loggers\tensorboard.py pytorch_lightning\loggers\test_tube.py pytorch_lightning\loggers\wandb.py pytorch_lightning\trainer\distrib_parts.py pytorch_lightning\trainer\trainer.py tests\loggers\test_all.py tests\models\test_horovod.py                                              
73	2143	Fix checkpoint warning for floats	added warning saving checkpoint reason native python float supported think actually quite common especially library e g scipy involved computing metric say checkpoint saved actually checkpoint still saved check actually change saving logic besides giving warning	2020-06-11 02:44:58	1591843498	resolved fixed	97e62b38cfa0c9ce14050b603ec3e735ba760a71	1601864329	pytorch_lightning\core\step_result.py tests\trainer\logging\test_eval_loop_logging_1_0.py                                                                  
74	2167	The docker image tagged with Pytorch 1.5 and Python 3.8, has Pytorch 1.4 installed and is running Python 3.7	bug docker image tagged pytorch eg torch installed seen via pip list also running python instead python tag indicates reproduce steps reproduce behavior pull docker image docker pull pytorchlightning pytorch lightning py3 torch1 run container docker run rm init pytorchlightning pytorch lightning py3 torch1 check version python pytorch containeruser c5c87a61b71c python version python containeruser pip list grep torch pytorch lightning torch expected behavior since tag docker image py3 torch1 expect see running python pytorch environment n	2020-06-13 00:54:14	1592009654	resolved fixed	2f739f5977640bb8580b82a11f322f81f1b90d09	1593222368	.github\workflows\docker-builds.yml                                                                    
75	2180	Global Gradient calculation is turned off during validation step.	error occurs validation step tradition calculation turned runtime either specifically enable restart runtime	2020-06-14 09:57:52	1592128672	resolved fixed	25c7465591371f8fe4b4244ccc996706f4136cea	1592405578	pytorch_lightning\trainer\training_loop.py                                                                    
76	2188	[hparams] save_hyperparameters doesn't save kwargs	questions help use hyperparemeters like doc class litmnist lightningmodule def init self layer dim learning rate kwargs super init call save layer dim learning rate checkpoint self save hyperparameters model checkpoint save args kwargs kwargs important args num frame img size img std must used creating dataloader tedious writes init explicitly make code clean hide kwargs use hparams ok recommended use hparams good idea deal problem	2020-06-15 03:10:15	1592190615	resolved fixed	6ae9a97b09fd8e3239219c2882c6f3cc31a2ccf8	1592536105	pytorch_lightning\core\lightning.py pytorch_lightning\core\saving.py tests\models\test_hparams.py                                                                
77	2205	[metrics] Accuracy Metric: Tensors must be CUDA and dense	try new accuracy metric throw error traceback recent call last file main py line main hparams file main py line main trainer fit model file mnt lustre maxiao1 anaconda3 lib python3 site package pytorch lightning trainer trainer py line fit self ddp train task model file mnt lustre maxiao1 anaconda3 lib python3 site package pytorch lightning trainer distrib data parallel py line ddp train self run pretrain routine model file mnt lustre maxiao1 anaconda3 lib python3 site package pytorch lightning trainer trainer py line run pretrain routine false file mnt lustre maxiao1 anaconda3 lib python3 site package pytorch lightning trainer evaluation loop py line evaluate output self evaluation forward model batch batch idx dataloader idx test mode file mnt lustre maxiao1 anaconda3 lib python3 site package pytorch lightning trainer evaluation loop py line evaluation forward output model args file mnt lustre maxiao1 anaconda3 lib python3 site package torch nn module module py line call result self forward input kwargs file mnt lustre maxiao1 anaconda3 lib python3 site package pytorch lightning override data parallel py line forward output self module validation step input kwargs file mnt lustre maxiao1 pvm model baseline py line validation step acc self accuracy label hat label file mnt lustre maxiao1 anaconda3 lib python3 site package pytorch lightning metric metric py line call return apply collection self orig call args kwargs torch tensor file mnt lustre maxiao1 anaconda3 lib python3 site package pytorch lightning metric converter py line new func return func apply result dec args dec kwargs file mnt lustre maxiao1 anaconda3 lib python3 site package pytorch lightning utility apply func py line apply collection return function data args kwargs file mnt lustre maxiao1 anaconda3 lib python3 site package pytorch lightning metric converter py line sync ddp available async op false file mnt lustre maxiao1 anaconda3 lib python3 site package torch distributed distributed c10d py line reduce work default pg allreduce tensor opts runtimeerror tensors must cuda dense code pred pred view pred shape label label view valid index torch label select valid part calculate pred pred valid index contiguous label label valid index contiguous loss self loss fn pred label label hat torch argmax pred dim type label acc self accuracy label hat label also question tensormetric default reduce op sum automatically calculate average acc	2020-06-16 02:29:09	1592274549	resolved fixed	17d87731062691f4510c75f12f2ce63b5dde0a43	1598439689	CHANGELOG.md pytorch_lightning\core\step_result.py pytorch_lightning\metrics\converters.py pytorch_lightning\metrics\functional\classification.py pytorch_lightning\metrics\metric.py tests\base\model_train_steps.py tests\metrics\test_classification.py tests\metrics\test_converters.py tests\metrics\test_metrics.py tests\metrics\test_sklearn.py                                                  
78	224	set_epoch for DistributedSampler	describe bug pytorch example suggests use set epoch function distributedsampler class epoch start could find function call lightning trainer module line seen distributedsampler class code set epoch function required set seed function call confirm function called distributedsampler training dataset point lightning trainer module	2019-09-15 19:54:42	1568577282	resolved fixed	c0f3b6b035f955fc371dec412d3816712f3fc1dd	1568643660	pytorch_lightning\trainer\trainer.py                                                                    
79	2254	"Single node DDP: ""Default process group is not initialized"""	bug unable start single node ddp training reproduce going run gpu template method running template result error python pl example basic example gpu template gpus distributed backend ddp spawn python pl example basic example gpu template gpus distributed backend ddp gpu available true used true tpu available false using tpu core cuda visible devices traceback recent call last file opt conda lib python3 runpy py line run module main main mod spec file opt conda lib python3 runpy py line run code exec code run globals file opt conda lib python3 site package pl example basic example gpu template py line main hyperparams file opt conda lib python3 site package pl example basic example gpu template py line main trainer fit model file opt conda lib python3 site package pytorch lightning trainer trainer py line fit self barrier fit prepare data file opt conda lib python3 site package pytorch lightning trainer trainer py line barrier torch distrib barrier file opt conda lib python3 site package torch distributed distributed c10d py line barrier check default pg file opt conda lib python3 site package torch distributed distributed c10d py line check default pg default process group initialized assertionerror default process group initialized	2020-06-19 02:37:22	1592534242	resolved fixed	57d5f6e74a3bcd8f5c73211ba3a4e2480fcc1114	1592541740	docs\source\trainer.rst pytorch_lightning\core\hooks.py pytorch_lightning\trainer\distrib_data_parallel.py pytorch_lightning\trainer\distrib_parts.py pytorch_lightning\trainer\trainer.py pytorch_lightning\trainer\training_loop.py                                                          
80	2281	RuntimeError: OrderedDict mutated during iteration	bug getting runtimeerror ordereddict mutated iteration seems like using lightningmodule object modelsummary trainer cause error reproduce pytorch lightning core memory import modelsummary model cifarnet pl module would work modelsummary model mode full trainer trainer fast dev run true gpus trainer fit model steps reproduce behavior view model summary using modelsummary class call trainer fit object stacktrace runtimeerror traceback recent call last checking error trainer trainer fast dev run true gpus trainer fit model frame usr local lib python3 dist package pytorch lightning trainer trainer py fit self model train dataloader val dataloaders elif self single gpu self single gpu train model elif self use tpu pragma cover usr local lib python3 dist package pytorch lightning trainer distrib part py single gpu train self model self reinit scheduler property self optimizers self lr scheduler self run pretrain routine model def tpu train self tpu core idx model usr local lib python3 dist package pytorch lightning trainer trainer py run pretrain routine self model core training loop self train def test usr local lib python3 dist package pytorch lightning trainer training loop py train self run tng epoch self run training epoch self max step self max step self global step usr local lib python3 dist package pytorch lightning trainer training loop py run training epoch self run train step output self run training batch batch batch idx batch result grad norm dic batch step metric batch output output usr local lib python3 dist package pytorch lightning trainer training loop py run training batch self batch batch idx calculate loss loss batch output optimizer closure check loss model weight nan usr local lib python3 dist package pytorch lightning trainer training loop py optimizer closure opt idx self hiddens else output dict self training forward split batch batch idx opt idx self hiddens format reduce output accordingly usr local lib python3 dist package pytorch lightning trainer training loop py training forward self batch batch idx opt idx hiddens batch self transfer batch gpu batch gpu id args batch output self model training step args tpu support training step self batch batch idx def training step self batch batch idx x batch hat self x return loss f cross entropy hat usr local lib python3 dist package torch nn module module py call self input kwargs result self slow forward input kwargs else result self forward input kwargs hook self forward hook value hook result hook self input result forward self x def forward self x return self model x def prepare data self usr local lib python3 dist package torch nn module module py call self input kwargs else result self forward input kwargs hook self forward hook value hook result hook self input result hook result none runtimeerror ordereddict mutated iteration expected behavior able use object class environment cuda gpu tesla t4 available true version packages numpy pytorch debug false pytorch version cu101 pytorch lightning tensorboard tqdm system os linux architecture processor x86 python version smp wed feb pst	2020-06-19 20:22:20	1592598140	resolved fixed	f972ab3a828eae1847a793da0b2c25c6074647a4	1592653127	CHANGELOG.md pytorch_lightning\core\memory.py tests\core\test_memory.py                                                                
81	2286	example_input_array dtype	currently assumed example input array dtype equal model dtype necessarily correct e g input vector int pytorch lightning pytorch lightning core memory py line input apply collection input torch tensor lambda x x type model dtype	2020-06-19 21:38:11	1592602691	resolved fixed	6bfcfa8671c4bf54b34290171f191db65fa27d8c	1593947842	CHANGELOG.md pytorch_lightning\core\memory.py tests\core\test_memory.py                                                                
