id	bug_id	summary	description	report_time	report_timestamp	status	commit	commit_timestamp	files
124	2688	Training on GPU failed with Torchtext when using include_lengths=True in torchtext.data.Field	bug issue raise pytorch lightning utility apply func py assumes attribute batch trochtext tensors however torchtext data field configured include length tensor include length true field tuple bugfix prepared pr submitted soon reproduce steps reproduce behavior use torchtext field include length true gpu machine fit model training work cpu fails gpu typeerror unpack non iterable nonetype object full error message traceback recent call last file debug torchtext py line trainer fit model file home1 thschaaf miniconda3 envs p37 lib python3 site package pytorch lightning trainer trainer py line fit result self single gpu train model file home1 thschaaf miniconda3 envs p37 lib python3 site package pytorch lightning trainer distrib part py line single gpu train result self run pretrain routine model file home1 thschaaf miniconda3 envs p37 lib python3 site package pytorch lightning trainer trainer py line run pretrain routine self train file home1 thschaaf miniconda3 envs p37 lib python3 site package pytorch lightning trainer training loop py line train self run training epoch file home1 thschaaf miniconda3 envs p37 lib python3 site package pytorch lightning trainer training loop py line run training epoch batch output self run training batch batch batch idx file home1 thschaaf miniconda3 envs p37 lib python3 site package pytorch lightning trainer training loop py line run training batch self hiddens file home1 thschaaf miniconda3 envs p37 lib python3 site package pytorch lightning trainer training loop py line optimizer closure hiddens file home1 thschaaf miniconda3 envs p37 lib python3 site package pytorch lightning trainer training loop py line training forward batch self transfer batch gpu batch gpu id file home1 thschaaf miniconda3 envs p37 lib python3 site package pytorch lightning trainer distrib part py line transfer batch gpu return self transfer batch device batch device file home1 thschaaf miniconda3 envs p37 lib python3 site package pytorch lightning trainer distrib part py line transfer batch device return model transfer batch device batch device file home1 thschaaf miniconda3 envs p37 lib python3 site package pytorch lightning core hook py line transfer batch device return move data device batch device file home1 thschaaf miniconda3 envs p37 lib python3 site package pytorch lightning utility apply func py line move data device return apply collection batch dtype transferabledatatype batch function batch file home1 thschaaf miniconda3 envs p37 lib python3 site package pytorch lightning utility apply func py line apply collection return function data args kwargs file home1 thschaaf miniconda3 envs p37 lib python3 site package pytorch lightning utility apply func py line batch device field getattr data field device non blocking true attributeerror tuple object attribute exception ignored traceback recent call last file home1 thschaaf miniconda3 envs p37 lib python3 site package tqdm std py line del file home1 thschaaf miniconda3 envs p37 lib python3 site package tqdm std py line close file home1 thschaaf miniconda3 envs p37 lib python3 site package tqdm std py line display file home1 thschaaf miniconda3 envs p37 lib python3 site package tqdm std py line repr file home1 thschaaf miniconda3 envs p37 lib python3 site package tqdm std py line format dict typeerror unpack non iterable nonetype object code sample import torch torch import nn tensor import pytorch lightning pl pytorch lightning import trainer seed everything torchtext import data seed everything def get debug data loader text field data field sequential true pad first false init token eos token include length true example1 data example example fromdict text b c c text text text field example2 data example example fromdict text b c text text text field example3 data example example fromdict text c b text text text field dataset data dataset example1 example2 example3 text text field text field build vocab dataset iterator data iterator dataset batch size sort key none device none batch size fn none train true repeat false shuffle none sort none sort within batch none return iterator text field class debugmodel pl lightningmodule def init self super debugmodel self init setup data loader self debug data loader self text field get debug data loader self learning rate self hid dim pad idx self text field vocab stoi self criterion nn crossentropyloss ignore index pad idx self input dim len self text field vocab self enc emb dim keep small debugging self embedding nn embedding self input dim self enc emb dim self rnn nn gru self enc emb dim self hid dim bidirectional false self nn linear self hid dim self embedding num embeddings self output dim len self text field vocab def configure optimizers self return torch optim adam self parameter lr self learning rate def forward self input seq length embedded tensor self embedding input seq packed embedded tensor torch nn utils rnn pack padded sequence embedded length batch first false enforce sorted false packed output hidden self rnn packed embedded sent len batch size emb dim output length torch nn utils rnn pad packed sequence packed output output sent len batch size hid dim n direction hidden n layer n direction batch size hid dim output output squeeze prediction self output return prediction staticmethod def parse batch batch source batch text source length batch text return source source length def training step self batch batch nb x self parse batch batch target target length x output self forward target target length loss self criterion output view output shape target view prefix train tensorboard log f prefix loss loss item result loss loss log tensorboard log return result def train dataloader self return self debug data loader model debugmodel cuda device cnt torch cuda device count cuda device cnt use num cuda device else use num cuda device none trainer trainer fast dev run false max step none gradient clip val weight summary full gpus use num cuda device show progress bar true trainer fit model expected behavior raise error environment cuda gpu titan x pascal available true version packages numpy pytorch debug false pytorch version pytorch lightning tensorboard tqdm system os linux architecture processor x86 python version smp tue mar utc additional context	2020-07-24 19:28:26	1595618906	resolved fixed	a6719f09f0a383034f4285d65cba880208a03ae4	1596196388	CHANGELOG.md pytorch_lightning\utilities\apply_func.py tests\utilities\test_apply_func_torchtext.py                                                                
125	2691	Subprocess launched in ddp have the wrong cwd when using hydra.	bug details comment talked omry issue send fix soon reproduce please see comment posted expected behavior cwd subprocesses parent relative path work	2020-07-24 20:00:08	1595620808	resolved fixed	b7f613ba6da32941bc86e9188629b572b10db4ad	1595968408	pytorch_lightning\trainer\distrib_data_parallel.py                                                                    
126	272	Trainer track_grad_norm always results in 0	describe bug trainer flag track grad norm allows u log gradient norm tensorboard flag checked run tng epoch function training step validation step however training step run tng batch call model optimizer step default implementation call optimizer zero grad result tracked gradient norm always zero moreover optional run evaluation call validatin step result call model zero grad assume also result zero gradient norm reproduce steps reproduce behavior train model track grad norm flag set true tensorboard logging enabled go tensorboard check gradient norm expected behavior gradient norm always zero desktop please complete following information os windows version	2019-10-01 08:19:47	1569917987	resolved fixed	41236c7bbbe2a22714c19b625bdf557854d747e8	1570029068	pytorch_lightning\trainer\trainer.py                                                                    
127	2724	Issues with Confusion Matrix normalization and DDP computation	bug started using confusionmatrix metric compute normalized confusion matrix within mult gpu ddp environment however found following issue normalization divisor computed correctly row wise manner however division applied column wise normalization protect divide zero data particular row usual case well designed validation set possible large number unbalanced class limit val batch small debugging way specify number class confusion matrix critical performing ddp reduction possible automatic computation number class could produce different answer process encountered possibility using large number unbalanced class one ddp process see true data declaration last class causing number class one le process bug sometimes cause entire training process hang needed manually kill ddp process computing normalized confusion matrix ddp reduction sum reduction need happen prior normalization reproduce mean reproduce issue attached two python script change extension txt would upload github script confusion matrix py expose first two issue normalization within single process script confusion matrix ddp py expose final two issue computing metric within model trained using ddp two gpus script create class problem sample unevenly divided among class true confusion matrix computed within script printed standard along confusion matrix computed pytorch lightning confusion matrix py txt confusion matrix ddp py txt steps reproduce behavior download script rename remove txt extension confusion matrix py machine least gpu compare true test confusion matrix confusion matrix ddp py machine least gpus computes unnormalized confusion matrix compare true test confusion matrix warning may hang process require manually kill process confusion matrix ddp py normalize machine least gpus computes normalized confusion matrix compare true test confusion matrix warning may hang process require manually kill process expected behavior computed confusion matrix identical true confusion matrix printed within script provided environment pytorch version e g py3 cuda10 cudnn7 os e g linux centos installed pytorch conda pip source conda build command used compiling source na python version cuda cudnn version conda cudatoolkit hfd86e86 gpu model configuration geforce gtx geforce gtx solution forked pytorch lightning created fix issue willing turn pull request solution first two issue require major change third issue required addition new argument confusionmatrix number class optional final argument api backwards compatible fourth issue involved required modifying confusionmatrix derive metric rather tensormetric us internal class drive tensormetric manner forward delegate computation unnormalized confusion matrix ddp reduction internal class performing normalization ddp reduction complete incrementally fixed issue easier understanding issues issue issue e3e0743 validate solution confusion matrix py machine least gpu compare true test confusion matrix confusion matrix ddp py set num class machine least gpus compare true test confusion matrix confusion matrix ddp py set num class normalize machine least gpus compare true test confusion matrix note addition set num class ddp script	2020-07-27 14:32:27	1595860347	resolved fixed	a552d4a2d5056705c68f2eed570a83ee3160b3bc	1600070751	pytorch_lightning\metrics\functional\classification.py tests\metrics\functional\test_classification.py tests\metrics\test_classification.py                                                                
128	2742	[DataModule] `prepare_data()` and `setup()` not called	bug seems using datamodule separate training logic data loading five method called last three actually used witch problematic since datasets used data loader assigned reproduce steps reproduce behavior run code sample import torch pytorch lightning import lightningdatamodule pytorch lightning core lightning import lightningmodule pytorch lightning trainer import trainer torch nn import l1loss linear torch optim import sgd torch utils data import dataloader class mydatamodule lightningdatamodule def init self super init def prepare data self print prepare data called train dataloader def setup self stage print setup called train dataloader self train dataset whatever def train dataloader self print train dataloader return dataloader self train dataset class mylightningmodule lightningmodule def init self super init self layer linear self loss function l1loss def forward self x return self layer x def configure optimizers self return sgd self parameter lr def training step self batch batch idx print even get raise notimplementederror data module mydatamodule model mylightningmodule trainer trainer gpus trainer fit model data module give attributeerror mydatamodule object attribute train dataset expected behavior entering train dataloader prepare data setup already executed thus train dataset attribute exist additional context imho come environment cuda gpu geforce rtx ti geforce rtx ti available true version packages numpy pytorch debug false pytorch version cu101 pytorch lightning tensorboard tqdm system os linux architecture processor x86 python version ubuntu smp tue dec utc	2020-07-28 15:54:40	1595951680	resolved fixed	036bcea4992865e8a82a5939f0d374530e17b778	1596327477	docs\source\datamodules.rst pytorch_lightning\accelerator_backends\cpu_backend.py pytorch_lightning\accelerator_backends\ddp_spawn_backend.py pytorch_lightning\accelerator_backends\dp_backend.py pytorch_lightning\accelerator_backends\gpu_backend.py pytorch_lightning\accelerator_backends\tpu_backend.py pytorch_lightning\core\datamodule.py pytorch_lightning\trainer\distrib_data_parallel.py pytorch_lightning\trainer\distrib_parts.py pytorch_lightning\trainer\trainer.py tests\base\datamodules.py tests\core\test_datamodules.py                                              
129	2769	Bug in `LightningModule.load_from_checkpoint`	suppose class model lightningmodule lightningmodule subclass parameter take params argparse namespace without default value along keyword argument might take default argument loading checkpoint model model params params kwargs save checkpoint model model load checkpoint params params kwargs behavior arises params passed positional argument throw error typeerror init got multiple value argument params come fact line pytorch lightning core saving py model cl cl args cl kwargs inspected cl args params params cl kwargs course params params stem fact line saving py args name kwargs case class take extra argument filter possible cl kwargs update model args elif args name args name cl init args name cl kwargs update args name model args else cl args model args cl args else clause getting called model args contains copy kwargs honest unclear exactly model args supposed clear block need checking stick copy item cl kwargs cl args something silly like replacing else clause typing import sequence elif isinstance model args sequence cl args tuple model args cl args fix problem said unclear exactly model args used sure better solution	2020-07-30 22:03:12	1596146592	resolved fixed	cea5f1f53876399dfaa0d37accdc527af7ca39af	1601916263	pytorch_lightning\core\saving.py tests\base\model_template.py tests\models\test_hparams.py tests\models\test_restore.py                                                              
130	2782	Use of shell=True could lead to shell injection	file pytorch lightning trainer training io py line number relevant code find job id job id o environ slurm job id cmd scontrol requeue format job id requeue job log info f requeing job job id result call cmd shell true executing shell command incorporate unsanitized input untrusted source make program vulnerable shell injection serious security flaw result arbitrary command execution reason use shell true strongly discouraged case command string constructed external input shell false disables shell based feature suffer vulnerability meaning anything set slurm job id environment variable perform code execution documentation also describes might need want shell true useful using python primarily enhanced control flow offer system shell still want convenient access shell feature shell pipe filename wildcards environment variable expansion expansion user home directory looking code look like need feature switch shell false change functionality gaining security benefit shell false	2020-07-31 17:56:06	1596218166	resolved fixed	96eb6ebacd5b8bba2dea4741355f576e8f1c6a16	1596338757	pytorch_lightning\trainer\training_io.py                                                                    
131	2844	Tensorboard logger fails to save model OmegaConf hparams	bug tensorboard logger fails log module hyperparameters configured omegaconf happens updating logger hparams trainer call logger log hyperparams inside log hyperparams logger hparams updated cause hparams type dict instead dictconfig result branch save hparams yaml never triggered stacktrace logging hyperparams reproduce code sample hacky fix would something like changing hparams update use inside tensorboard logger isinstance params container self hparams omegaconf merge self hparams params else self hparams update params expected behavior environment please copy paste output environment collection script fill checklist manually get script run wget security purpose please check content collect env detail py running python collect env detail py pytorch version e g os e g linux installed pytorch conda pip source build command used compiling source python version cuda cudnn version gpu model configuration relevant information additional context	2020-08-06 01:26:00	1596677160	resolved fixed	b39f4798a6859d2237b48b29b39a2390164612c1	1596806001	CHANGELOG.md pytorch_lightning\core\saving.py pytorch_lightning\loggers\tensorboard.py pytorch_lightning\trainer\training_io.py tests\loggers\test_tensorboard.py                                                            
132	2859	Failing docker-Conda build	bug seems connection issue creating conda env reproduce additional context	2020-08-07 10:17:24	1596795444	resolved fixed	ad956b5ed9add7e601dfbe57e96ea586305127d0	1596802462	.github\workflows\docker-builds.yml                                                                    
133	286	Double check that fast_dev_run works correctly	run single validation training batch cover full loop suggested adefazio	2019-10-02 16:53:38	1570035218	resolved fixed	608a90a490798a743410768a832309fe40b6ab7b	1570630988	pytorch_lightning\trainer\trainer.py                                                                    
134	2862	"Metrics error due to inplace operation, ""computation has been modified by an inplace operation""."	hey williamfalcon got new error since upgraded library today used accuracy metric got error code sample lightning module def training step self batch batch idx x batch hat self x loss f cross entropy hat acc accuracy hat functional metric classification tensorboard log train loss loss return loss loss log tensorboard log error msg runtimeerror one variable needed gradient computation modified inplace operation torch cuda longtensor version expected version instead hint enable anomaly detection find operation failed compute gradient torch autograd set detect anomaly true solved using clone method however clone feeding accuracy function error shown acc accuracy hat clone inconvenience user manually actually use code without clone upgrade latest might due latest update rebase causing error error shown f1 score metric	2020-08-07 12:37:41	1596803861	resolved fixed	d9d7e91a3b68fb7bbb966c73745a932ea95a2e6b	1596880898	pytorch_lightning\metrics\functional\classification.py                                                                    
135	2868	Throw warning for changing val_loss	add warning user changing val loss another keyword break checkpointing early stopping feature relying	2020-08-07 17:53:24	1596822804	resolved fixed	51de6802edd6c050ba3f2803724298eb059dc5ad	1597674568	pytorch_lightning\callbacks\early_stopping.py pytorch_lightning\callbacks\model_checkpoint.py pytorch_lightning\core\step_result.py tests\trainer\test_trainer_steps_result_return.py                                                              
136	2891	The total number of batches shows by the progress bar of the sanity check is wrong	bug total sanity check progress bar set pytorch lightning pytorch lightning callback progress py line self val progress bar total convert inf trainer num sanity val step len trainer val dataloaders progress bar always show trainer num sanity val step even length validation dataloader le trainer num sanity val step maybe total could computed pytorch lightning trainer import data loading num full val dataloader batch len dataloader data loading len dataloader else float inf dataloader trainer val dataloaders self val progress bar total convert inf sum min num batch trainer num sanity val step num batch num full val dataloader batch use private function data loading len check dataloader len maybe could make data loading len public could make num full val dataloader batch num full train dataloader batch member variable trainer update value pytorch lightning trainer data loading trainerdataloadingmixin reproduce progress bar sanity check following code num sanity val step len val data loader show validation sanity check code sample import time import pytorch lightning pl torch utils import data class dataset data dataset def init self length self element list range length def getitem self item return self element item def len self return len self element class model pl lightningmodule def forward self args kwargs pas def training step self args kwargs pas def train dataloader self pas def configure optimizers self pas def validation step self args kwargs time sleep return pl evalresult name main model model val dataset length val dataset dataset val dataset length val data loader data dataloader val dataset trainer pl trainer num sanity val step limit val batch max epoch trainer fit model val dataloaders val data loader expected behavior program validation sanity check environment cuda gpu available version packages numpy pytorch debug false pytorch version cpu pytorch lightning tensorboard tqdm system os windows architecture windowspe processor python version additional context	2020-08-09 04:52:31	1596948751	resolved fixed	a628d181ee662a77b708a12c51477f912ce02f63	1601814738	CHANGELOG.md pytorch_lightning\callbacks\progress.py tests\callbacks\test_progress_bar.py tests\trainer\test_trainer.py                                                              
137	2916	ModelCheckpoint with custom filepath don't support training on multiple nodes	bug training multiple node using custom raise caused following line code model checkpoint py l127 maybe try except block needed	2020-08-11 15:41:05	1597160465	resolved fixed	56396abe9839fa075bcc087c32f098145b0bdc9f	1597228277	pytorch_lightning\callbacks\model_checkpoint.py pytorch_lightning\trainer\distrib_data_parallel.py pytorch_lightning\trainer\trainer.py pytorch_lightning\trainer\training_io.py pytorch_lightning\utilities\cloud_io.py                                                            
