id	bug_id	summary	description	report_time	report_timestamp	status	commit	commit_timestamp	files
170	3393	MLFlow Logger slows training steps dramatically, despite only setting metrics to be logged on epoch	bug using mlflow logger remote server logging per step introduces latency slows training loop tried configure logging metric per epoch however seems still result much slower performance suspect logger still communicating mlflow server training step reproduce start mlflow server locally mlflow ui run minimal code example mlflow logger set use default file uri uncomment tracking uri use local mlflow server run code see time drop iteration per second code sample import torch torch utils data import tensordataset dataloader import pytorch lightning pl class mymodel pl lightningmodule def init self super init self num example self num valid self batch size self lr self wd self num feature self linear torch nn linear self num feature self loss func torch nn mseloss self x torch rand self num example self num feature self self x matmul torch rand self num feature torch rand self num example def forward self x return self linear x def train dataloader self d tensordataset self x self num valid self x self num valid dl dataloader d batch size self batch size return dl def val dataloader self d tensordataset self x self num valid self x self num valid dl dataloader d batch size self batch size return dl def configure optimizers self return torch optim adam self parameter lr self lr weight decay self wd def training step self batch batch idx x batch yhat self x loss self loss func yhat result pl trainresult minimize loss result log train loss loss epoch true step false return result def validation step self batch batch idx x batch yhat self x loss self loss func yhat result pl evalresult early stop loss result log val loss loss epoch true step false return result name main pytorch lightning logger import tensorboardlogger mlflowlogger mlf logger mlflowlogger experiment name f mymodel tracking uri trainer pl trainer min epoch max epoch early stop callback true logger mlf logger model mymodel trainer fit model expected behavior using trainresult evalresult manually handling metric logging using training epoch end validation epoch end callback possible avoid mlflow logger communicating server training loop would make feasible implement mlflow remote server used experiment tracking environment cuda gpu available false version none packages numpy pytorch debug false pytorch version cpu pytorch lightning tensorboard tqdm system os linux architecture processor x86 python version smp tue may utc additional context host mlflow instance aws would like able track experiment without affecting training speed appears general mlflow logger much le performant default tensorboard logger would much problem could avoid call logger training loop solution done bit debugging codebase able isolate cause two place pytorch lightning pytorch lightning logger mlflow py lines d438ad8 property def run id self create experiment exist get run id self experiment return self run id self experiment called regardless whether self run id exists add self run id avoid calling self mlflow client get experiment name self experiment name step however still call time log metric mflow property self experiment pytorch lightning pytorch lightning logger mlflow py lines d438ad8 property rank zero experiment def experiment self mlflowclient r actual mlflow object use mlflow feature class pytorch lightning core lightning lightningmodule following example self logger experiment mlflow function expt self mlflow client get experiment name self experiment name store expt within logger call self mlflow client get experiment name exist eliminate overhead run fast fast tensorboard logger mlflow logging appears working expected happy raise pr fix	2020-09-08 06:28:36	1599546516	resolved fixed	656c1af0df0cd0a8102a69c9c5045e86dc2b6b3a	1599644306	CHANGELOG.md pytorch_lightning\loggers\mlflow.py tests\loggers\test_mlflow.py                                                                
171	3417	CometLogger failing without save_dir	bug cometmllogger api key without save dir result error happens due save dir set later train loop try read fails fixed setting save dir none supply pr moment reproduce steps reproduce behavior model lightningmodel comet logger cometlogger api key key workspace workspace trainer trainer logger comet logger trainer fit model traceback recent call last trainer fit model file python3 site package pytorch lightning trainer state py line wrapped fn result fn self args kwargs file python3 site package pytorch lightning trainer trainer py line fit result self accelerator backend train model file python3 site package pytorch lightning accelerator gpu backend py line train result self trainer run pretrain routine model file python3 site package pytorch lightning trainer trainer py line run pretrain routine self train file python3 site package pytorch lightning trainer training loop py line train self train start file python3 site package pytorch lightning trainer callback hook py line train start callback train start self self get model file python3 site package pytorch lightning utility distributed py line wrapped fn return fn args kwargs file python3 site package pytorch lightning callback model checkpoint py line train start save dir trainer logger save dir trainer default root dir file python3 site package pytorch lightning logger comet py line save dir return self save dir additional context	2020-09-09 12:37:07	1599655027	resolved fixed	5b4db52851000d5e4eca8c680d851bcdaafc3a80	1599658055	pytorch_lightning\loggers\comet.py                                                                    
172	3424	DataModule with lr_find not supported	bug reproduce steps reproduce behavior create trainer trainer lightningmodule model datamodule data module call trainer lr find model datamodule data module error typeerror lr find got unexpected keyword argument datamodule code sample import torch import torch nn nn import pytorch lightning pl torch utils data import dataloader class datamodule pl lightningdatamodule def init self super init def gen set self start end vals torch tensor float range return torch stack torch sin vals torch co vals def train dataloader self return dataloader dataset self gen set def val dataloader self return dataloader dataset self gen set def test dataloader self return dataloader dataset self gen set class litmodel pl lightningmodule def init self feature super init self layer nn linear feature feature self layer nn linear feature feature self criterion nn mseloss self lr def forward self inp inp torch tanh self layer inp return self layer inp def training step self batch batch idx x batch hat self x loss self criterion hat x float return pl trainresult minimize loss def configure optimizers self return torch optim adam self parameter lr self lr self learning rate data module datamodule trainer pl trainer model litmodel feature lr finder trainer lr find model datamodule data module error expected behavior lr find function work passed train loader test loader invoking like fit environment packages numpy pytorch debug false pytorch version pytorch lightning tensorboard tqdm system os linux architecture processor x86 python	2020-09-09 16:18:23	1599668303	resolved fixed	e4e60e9b82adc48482db4721ce3e1fdc3ab6d6fe	1601541192	CHANGELOG.md pytorch_lightning\tuner\lr_finder.py pytorch_lightning\tuner\tuning.py tests\trainer\test_lr_finder.py                                                              
173	3487	Gradient norms are not logged unless row_log_interval==1	bug version guard calculate gradient norm log metric satisfied batch unless row log interval place guard seems batch idx self row log interval pytorch lightning pytorch lightning trainer training loop py lines b40de54 def save train loop metric logger self batch idx batch output metric logged log metric batch idx self row log interval self stop log metric self fast dev run log user requested information logger metric batch output batch log metric grad norm dic batch output grad norm dic len metric len grad norm dic self log metric metric grad norm dic however run batch backward pas batch idx self row log interval pytorch lightning pytorch lightning trainer training loop py lines b40de54 def run batch backward pas self split batch batch idx opt idx optimizer grad norms track gradient norm requested grad norm dic batch idx self row log interval float self track grad norm model self get model grad norm dic model grad norm self track grad norm reproduce steps reproduce behavior run code sample taken confirm gradient logged tensorboard change row log interval rerun code confirm gradient logged code sample import pytorch lightning pl torch utils data import tensordataset dataloader pytorch lightning logger tensorboard import tensorboardlogger torch optim import sgd import torch nn nn import torch class mwenet pl lightningmodule def init self super mwenet self init self first nn conv2d self second nn conv2d self loss nn l1loss def train dataloader self x y torch zero torch one d tensordataset x y return dataloader d def forward self x self first x self second return def configure optimizers self first sgd self first parameter lr second sgd self second parameter lr return second first def training step self batch batch idx optimizer idx x y batch self forward x return loss self loss y net mwenet logger tensorboardlogger tb log name testing trainer pl trainer track grad norm row log interval max epoch logger logger trainer fit net expected behavior gradients logged track grad norm true environment cuda gpu geforce gtx ti available true version packages numpy pytorch debug false pytorch version pytorch lightning tensorboard tqdm system os windows architecture windowspe processor amd64 family model stepping authenticamd python version additional context	2020-09-13 11:27:42	1599996462	resolved fixed	4ed96b2eb471124184144f96d259055e49ac97e7	1600188087	CHANGELOG.md pytorch_lightning\trainer\training_loop.py tests\models\test_grad_norm.py                                                                
174	3549	Bug in validation_epoch_end	bug documentation described running end validation epoch need necessarily return anything running slightly modified version example doc seemingly run single batch validation data return error nothing returned reproduce mwe import o import torch import torch nn functional f torchvision datasets import mnist torchvision import transforms torch utils data import dataloader import pytorch lightning pl torch utils data import random split class litmodel pl lightningmodule def init self super init self layer torch nn linear self layer torch nn linear def forward self x x x view x size x self layer x x f relu x x self layer x return x def configure optimizers self optimizer torch optim adam self parameter lr return optimizer def training step self batch batch idx x batch hat self x loss f cross entropy hat return loss loss def validation step self batch batch idx x batch hat self x loss f cross entropy hat return val loss loss def validation epoch end self validation step output print length output format len validation step output dummy return value avoid error return val loss model litmodel dataset mnist o getcwd download true train false transform transforms totensor train val random split dataset train loader dataloader train val loader dataloader val train trainer pl trainer progress bar refresh rate max epoch weight summary none gpus trainer fit model train loader val loader output gpu available true used true tpu available false using tpu core cuda visible devices usr local lib python3 dist package pytorch lightning utility distributed py userwarning could log computational graph since model example input array attribute set input array given warning warn args kwargs length output length output length output length output length output saving latest checkpoint length output return value given validation epoch end following error occurs attributeerror traceback recent call last train trainer pl trainer progress bar refresh rate max epoch weight summary none gpus trainer fit model train loader val loader frame usr local lib python3 dist package pytorch lightning trainer state py wrapped fn self args kwargs entering none self state entering result fn self args kwargs interrupted state set inside run function indicate run interrupted usr local lib python3 dist package pytorch lightning trainer trainer py fit self model train dataloader val dataloaders datamodule self accelerator backend gpubackend self model self accelerator backend setup model result self accelerator backend train model elif self use tpu usr local lib python3 dist package pytorch lightning accelerator gpu backend py train self model def train self model result self trainer run pretrain routine model return result usr local lib python3 dist package pytorch lightning trainer trainer py run pretrain routine self model run val batch training start self run sanity check ref model model clear cache training usr local lib python3 dist package pytorch lightning trainer trainer py run sanity check self ref model model num loader len self val dataloaders max batch self num sanity val step num loader eval result self evaluate model self val dataloaders max batch false allow return eval usr local lib python3 dist package pytorch lightning trainer evaluation loop py evaluate self model dataloaders max batch test mode log callback metric self update callback metric eval result using eval result write prediction disk available usr local lib python3 dist package pytorch lightning trainer evaluation loop py update callback metric self eval result using eval result flat val loss eval result else flat flatten dict eval result self callback metric update flat else usr local lib python3 dist package pytorch lightning utility parsing py flatten dict source result result k v source item isinstance v dict flatten dict v result attributeerror nonetype object attribute item expected behavior output validation epoch end contain result batch test validation batch running background could explain result one batch included first loop return value addressed error tell included release perhaps missing something environment pytorch pytorch lightning	2020-09-18 13:00:13	1600434013	resolved fixed	9acee67c31c84dac74cc6169561a483d3b9c9f9d	1600560050	pytorch_lightning\trainer\connectors\logger_connector.py pytorch_lightning\trainer\logging.py tests\base\model_valid_epoch_ends.py tests\trainer\test_trainer_steps_result_return.py                                                              
175	3578	"Incorrect ""Saving latest checkpoint"" warning"	bug saving latest checkpoint warning appears regardless whether modelcheckpoint exists save last set true pytorch lightning pytorch lightning trainer training loop py lines a71d62d save latest checkpoint rank zero warn saving latest checkpoint self check checkpoint callback check val false force save true pytorch lightning pytorch lightning trainer training loop py lines a71d62d def check checkpoint callback self check val force save false model self trainer get model val loop present fast dev run still need call checkpoint todo bake logic checkpoint callback activate overridden validation step model check val activate force save checkpoint callback c c self trainer callback isinstance c modelcheckpoint c validation end self trainer model c checkpoint callback might confuse user think last checkpoint got saved proposed change def check checkpoint callback self check val force save false model self trainer get model val loop present fast dev run still need call checkpoint todo bake logic checkpoint callback activate overridden validation step model check val activate force save checkpoint callback c c self trainer callback isinstance c modelcheckpoint c save last c checkpoint callback rank zero warn saving latest checkpoint c validation end self trainer model c checkpoint callback	2020-09-21 00:54:24	1600649664	resolved fixed	ed12e422a42472af1acb88f870dba3d43710b31d	1601036286	pytorch_lightning\trainer\training_loop.py tests\callbacks\test_model_checkpoint.py                                                                  
176	3597	distributed training: ModelCheckpoint is receiving bad data	reproduce minute tried master got unrelated wandb error gave trying reproduce must machine multiple gpus git clone git github com huggingface transformer git cd transformer pip install e pip install e example installs pytorch lightning git checkout pl checkpoint bug cd example seq2seq wget tar xzvf wmt en ro tar gz export max len export sshleifer student marian en ro python finetune py learning rate train predict fp16 val check interval data dir wmt en ro max source length max len max target length max len val max target length max len test max target length max len freeze encoder freeze embeds train batch size eval batch size tokenizer name model name path warmup step sortish sampler logger name wandb fp16 opt level o1 task translation num sanity val step model name path gpus num train epoch data dir wmt mar pl output dir dmar pl v3 save top k results l dmar pl v3 ckpt rw r r shleifer shleifer sep dmar pl v3 val avg bleu step count ckpt rw r r shleifer shleifer sep dmar pl v3 val avg bleu step count ckpt rw r r shleifer shleifer sep dmar pl v3 val avg bleu step count ckpt rw r r shleifer shleifer sep dmar pl v3 val avg bleu step count ckpt rw r r shleifer shleifer sep dmar pl v3 val avg bleu step count ckpt checkpoint much lower score pl think best checkpoint step cat dmar pl v3 metric json grep bleu val avg bleu val avg bleu val avg bleu val avg bleu val avg bleu best checkpoint step evaluate offline best checkpoint without truncation get val bleu make nearly certain number create save finetune py correct number saved path incorrect known issue workaround fix high priority suboptimal checkpoint saving huge productivity drain additional notes number logged wandb also low wrong one gpu number identical	2020-09-22 00:26:46	1600734406	resolved fixed	2aebf65241ab054df9256cc33d37236651691a48	1602070997	tests\checkpointing\test_model_checkpoint.py                                                                    
177	3600	Infinite hang when running `Trainer.test` after `Trainer.fit` with DDP	bug run trainer test running trainer fit distributed backend ddp system hang reproduce steps reproduce behavior run following script main py import o argparse import argumentparser pl example model lightning template import lightningtemplatemodel pytorch lightning import trainer seed everything seed everything def main args model lightningtemplatemodel var args trainer trainer argparse args args trainer fit model commented test complete otherwise hang trainer test model def run cli root dir o path dirname o path realpath file parent parser argumentparser add help false parser lightningtemplatemodel add model specific args parent parser root dir parser trainer add argparse args parser parser set default gpus args parser parse args main args name main run cli command line argument assuming gpus python main py gpus hidden dim max epoch distributed backend ddp running script cause program hang test phase expected behavior would expect trainer test complete rather hanging environment output collect env detail py cuda gpu geforce rtx ti geforce rtx ti available true version packages numpy pytorch debug false pytorch version pytorch lightning tqdm system os linux architecture elf processor x86 python version ubuntu smp sat sep utc pytorch version os ubuntu installed pytorch pip build command used compiling source python version cuda cudnn version gpu model configuration geforce rtx ti x2 list installed package output pip freeze absl py cachetools certifi chardet decorator fsspec future google auth google auth oauthlib grpcio idna importlib metadata markdown networkx numpy oauthlib packaging pillow pkg resource protobuf pyasn1 pyasn1 module pyparsing pytorch lightning pyyaml request request oauthlib rsa six tensorboard tensorboard plugin wit torch torchvision tqdm urllib3 werkzeug zipp additional context comment trainer fit everything work expected able pause execution hang running pycharm following stack frame main thread thread could get pause select selector py wait connection py poll connection py poll connection py get queue py worker loop worker py run process py bootstrap process py launch popen fork py init popen fork py popen context py popen context py start process py init dataloader py iter dataloader py run evaluation trainer py run test trainer py train test base backend py ddp train ddp backend py train ddp backend py fit trainer py wrapped fn state py test given model trainer py test trainer py wrapped fn state py main main py run cli main py main py	2020-09-22 01:50:07	1600739407	resolved fixed	d2a3d6aa8e8b69e6f373243bd25165a0963d7a53	1600808221	docs\source\multi_gpu.rst                                                                    
178	3619	ModelCheckpoint period should not always save on the first epoch	feature period work modelcheckpoint validation end epoch period save return e g period save epoch period save epoch period save epoch currently always run first epoch run every period epoch e g period save epoch period save epoch period save epoch would also allow period would never save save top k motivation want save checkpoint every period epoch current behaviour force always save first one	2020-09-23 02:00:38	1600826438	resolved fixed	3b2efe5b2afe664d88c9d5eda127774bba4cff4c	1601386605	CHANGELOG.md pytorch_lightning\callbacks\model_checkpoint.py tests\callbacks\test_model_checkpoint.py                                                                
179	3652	Creation of many data module instances incurs RecursionError	bug thank nice framework repeated hundred experiment time new instance single lightningdatamodule class recursionerror raised also found creating data module calling setup enough reproduce issue reproduce please look following code sample error message code sample import pytorch lightning pl class dummydm pl lightningdatamodule def setup self stage none pas name main max iters range max iters try dm dummydm dm setup except recursionerror print f recursionerror occured th iteration raise error message recursionerror occured th iteration traceback recent call last file test dm py line dm setup file workspace src venv lib python3 site package pytorch lightning core datamodule py line wrapped fn return fn args kwargs file workspace src venv lib python3 site package pytorch lightning core datamodule py line wrapped fn return fn args kwargs file workspace src venv lib python3 site package pytorch lightning core datamodule py line wrapped fn return fn args kwargs previous line repeated time file workspace src venv lib python3 site package pytorch lightning core datamodule py line wrapped fn fn name setup recursionerror maximum recursion depth exceeded comparison expected behavior code sample expected exit without output environment pytorch version e g pytorchlightning version os e g linux linux installed pytorch conda pip source pip build command used compiling source n python version cuda cudnn version gpu model configuration	2020-09-25 01:21:50	1600996910	resolved fixed	17c8c95fbc7b31f73671761430e86d881f6d6c6d	1601032190	pytorch_lightning\core\datamodule.py tests\core\test_datamodules.py                                                                  
180	3668	incorrect batch_sizes when Dataloader returns a dict with multiple tensors.	bug tracked batch size result object incorrect dataloader return dict multiple tensor reproduce create data loader return dict e g batch batcha tensor batchb tensor b entire batch size n n example batch size logged since len batch pytorch lightning pytorch lightning trainer evaluation loop py lines track batch size weighted average result obj isinstance output result result obj output track batch size len batch pytorch lightning pytorch lightning trainer training loop py lines track batch size weighted average result obj training step output track batch size len split batch expected behavior log correct batch size sure defined correct batch size multiple tensor expect tensor dict batch size maybe something like result obj isinstance batch dict batch batch list batch key result obj track batch size len batch	2020-09-26 15:38:17	1601134697	resolved fixed	b34c7add23553f10f6f0d7caf4177c67ee213f3a	1601947841	pytorch_lightning\core\step_result.py pytorch_lightning\loggers\tensorboard.py pytorch_lightning\trainer\evaluation_loop.py tests\base\boring_model.py tests\trainer\logging\test_train_loop_logging_1_0.py                                                            
181	367	setting gpus=-1 and gpus='-1' in Trainer give different behaviours	discovered looking code trainer constructor mention gpus however value passed accepted result different behaviour result gpus used use available gpus reproduce run model first setting trainer gpus parameter gpus used run model setting gpus available gpus used able set indicate gpus used believe useful behaviour issue function self parse gpu id gpus handling passed int implemented solution would implement equivalent logic happy submit pr	2019-10-14 05:21:19	1571030479	resolved fixed	2aba70e228b427b16e547e030ab3bbad736b5b00	1571821509	docs\Trainer\Distributed training.md pytorch_lightning\trainer\dp_mixin.py pytorch_lightning\trainer\trainer.py tests\test_models.py                                                              
