id	bug_id	summary	description	report_time	report_timestamp	status	commit	commit_timestamp	files
0	1092	tqdm fails in notebook for versions tqdm&lt; 4.41.0	bug tqdm notebook method version training fails notebook lower version tqdm current requirement enforce reproduce train model tqdm colab notebook expected behavior attributeerror tqdm notebook object attribute reset	2020-03-08 15:46:05	1583682365	resolved fixed	36274bed49cf40c0d9bdabb3058674879badf1e4	1584624198	requirements.txt                                                                    
1	1114	ReduceLROnPlateau scheduler type check	bug incorrect type check scheduler class reducelronplateau pytorch lightning pytorch lightning trainer trainer py line bc01b9a isinstance scheduler optim lr scheduler reducelronplateau believe check isinstance scheduler optim lr scheduler reducelronplateau must look like isinstance scheduler scheduler optim lr scheduler reducelronplateau reproduce steps reproduce behavior create scheduler type optim lr scheduler reducelronplateau configure optimizers method lightningmodule class return optimizer scheduler method place list return optimizer scheduler execute trainer fit module put break point pytorch lightning pytorch lightning trainer trainer py line bc01b9a scheduler reduce plateau make sure condition never true	2020-03-10 22:15:58	1583878558	resolved fixed	384e124490f7a629dc677fc5b658b69afade0a04	1584383710	CHANGELOG.md pytorch_lightning\trainer\trainer.py tests\models\__init__.py tests\models\mixins.py tests\trainer\test_optimizers.py                                                            
2	1116	Wandb logger doesn't upload saved model checkpoint for final epoch	bug training model tpu using wandb logger checkpoint last epoch trained get uploaded wandb reproduce colab notebook	2020-03-11 02:47:18	1583894838	resolved fixed	a707d4bea1a78a98265fd1ea5b7a7a6cadc37fb9	1585608306	CHANGELOG.md pytorch_lightning\loggers\wandb.py tests\loggers\test_wandb.py                                                                
3	1119	Checkpoint fails in single node multi-GPU mode using  DDP	bug checkpoint fails single node multi gpu mode using ddp reproduce python pl example basic example gpu template py distributed backend ddp gpus epoch l home xz anaconda3 envs x lib python3 multiprocessing semaphore tracker py userwarning semaphore tracker appear leaked semaphore clean shutdown len cache traceback recent call last file gpu template py line main hyperparams file gpu template py line main trainer fit model file home xz anaconda3 envs x lib python3 site package pytorch lightning trainer trainer py line fit mp spawn self ddp train nprocs self num gpus args model file home xz anaconda3 envs x lib python3 site package torch multiprocessing spawn py line spawn spawn context join file home xz anaconda3 envs x lib python3 site package torch multiprocessing spawn py line join raise exception msg exception process terminated following error traceback recent call last file home xz anaconda3 envs x lib python3 site package torch multiprocessing spawn py line wrap fn args file home xz anaconda3 envs x lib python3 site package pytorch lightning trainer distrib data parallel py line ddp train self run pretrain routine model file home xz anaconda3 envs x lib python3 site package pytorch lightning trainer trainer py line run pretrain routine self train file home xz anaconda3 envs x lib python3 site package pytorch lightning trainer training loop py line train self run training epoch file home xz anaconda3 envs x lib python3 site package pytorch lightning trainer training loop py line run training epoch self call checkpoint callback file home xz anaconda3 envs x lib python3 site package pytorch lightning trainer training loop py line call checkpoint callback self checkpoint callback validation end self self get model file home xz anaconda3 envs x lib python3 site package pytorch lightning callback model checkpoint py line validation end self check save filepath current epoch file home xz anaconda3 envs x lib python3 site package pytorch lightning callback model checkpoint py line check save self del model delpath file home xz anaconda3 envs x lib python3 site package pytorch lightning callback model checkpoint py line del model o remove filepath filenotfounderror errno file directory home xz pytorch lightning pl example basic example lightning log version checkpoint epoch ckpt	2020-03-11 13:02:06	1583931726	resolved fixed	b4d4e489bf413ebf3288d29c5905d2292ce18d58	1584024600	pytorch_lightning\callbacks\model_checkpoint.py                                                                    
4	1131	Better message when DataLoader is wrong	verge bug improvement bug validation dataloader returning irrelevant staff accidentally length probably edge case combination error getting validation sanity check quite cryptic traceback recent call last file unet waveprop py line trainer fit model file mnt rds home code pytorch lightning pytorch lightning trainer trainer py line fit self run pretrain routine model file mnt rds home code pytorch lightning pytorch lightning trainer trainer py line run pretrain routine false file mnt rds home code pytorch lightning pytorch lightning trainer evaluation loop py line evaluate eval result model validation epoch end output file unet waveprop py line validation epoch end avg loss torch stack x val loss x output mean runtimeerror stack expects non empty tensorlist go code pytorch lightning hour understand happening maybe informative message would make sense one thing would check dataloader size think could take stab pr	2020-03-12 23:01:45	1584054105	resolved fixed	2ccc7456ca421afcdfba0c4482635c99e2593f70	1585608233	CHANGELOG.md pytorch_lightning\trainer\data_loading.py tests\base\__init__.py tests\base\mixins.py tests\trainer\test_dataloaders.py                                                            
5	1139	Can't cast Trainer automatically generated args to their required types	questions help question sure bug put like question problem want add trainer argument custom argumentparser object call add argparse args trainer classmethod method cast trainer argument required type force cast argument like trainer args update accumulate grad batch int trainer args accumulate grad batch train percent check float trainer args train percent check val percent check float trainer args val percent check val check interval int trainer args val check interval track grad norm int trainer args track grad norm max epoch int trainer args max epoch precision int trainer args precision gradient clip val float trainer args gradient clip val pas updated argument trainer trainer pytorch lightning trainer trainer args find central place trainer handle automatically generated argument type tried tried pas argument trainer without handling type instance cast accumulate grad batch integer type exception raised typeerror gradient accumulation support int dict type environment os linux packaging pip version	2020-03-13 12:22:58	1584102178	resolved fixed	ced662fc2790058f5a55ca20244b31003c970ee5	1585076127	CHANGELOG.md pl_examples\full_examples\semantic_segmentation\models\unet\model.py pl_examples\full_examples\semantic_segmentation\models\unet\parts.py pl_examples\full_examples\semantic_segmentation\semseg.py pytorch_lightning\trainer\trainer.py tests\trainer\test_trainer.py tests\trainer\test_trainer_cli.py                                                        
6	1143	`use_amp` is broken in 0.7.0	see use amp deprecated since trainer still accepts argument believe still bug issue hook deal specifically check however trainer set proposed solution use amp passed set precision raise deprecation warning	2020-03-13 17:21:41	1584120101	resolved fixed	4ed3027309fe1882554e9b7ffe33f1aa92c88106	1586175204	CHANGELOG.md pl_examples\basic_examples\gpu_template.py pl_examples\domain_templates\imagenet.py pytorch_lightning\trainer\auto_mix_precision.py pytorch_lightning\trainer\distrib_data_parallel.py pytorch_lightning\trainer\distrib_parts.py pytorch_lightning\trainer\trainer.py pytorch_lightning\trainer\training_loop.py                                                      
7	1155	No validation checks when overfit_pct is set	bug setting overfit pct value exclusive trainer validation check disabled reproduce worked minimal example reproduce bug import pytorch lightning pl import torch class dataset torch utils data dataset def init self input dim output dim super dataset self init self input dim input dim self output dim output dim def getitem self idx x torch rand self input dim torch randint self output dim return x def len self return class model pl lightningmodule def init self input dim output dim super model self init self layer torch nn linear input dim output dim self dataset dataset input dim output dim def forward self x yhat torch softmax self layer x return f nll loss logits def train dataloader self return torch utils data dataloader self dataset batch size def configure optimizers self return torch optim adam self parameter lr def training step self batch batch idx loss self forward batch return loss loss log loss loss def validation step self batch batch idx loss self forward batch return val loss loss log val loss loss name main model model trainer pl trainer overfit pct trainer fit model expected behavior validation check occur normally environment pytorch version debug build cuda used build pytorch os manjaro linux gcc version gcc cmake version could collect python version cuda available cuda runtime version gpu model configuration could collect nvidia driver version could collect cudnn version usr lib libcudnn versions relevant library pip numpy pip pytorch lightning pip torch pip torchvision conda mkl conda pytorch py3 cuda10 cudnn7 pytorch conda pytorch lightning pypi pypi conda torchvision py37 cu101 pytorch	2020-03-15 13:43:17	1584279797	resolved fixed	d735055e6fb6225ad11c566e3711888c0cb4a21e	1585075751	pytorch_lightning\trainer\__init__.py pytorch_lightning\trainer\trainer.py                                                                  
8	1156	ReduceLROnPlateau does not recognise val_loss despite progress_bar dict	bug training model get following message file c users luc miniconda3 envs pytorch lib site package pytorch lightning trainer training loop py line train raise misconfigurationexception pytorch lightning utility debugging misconfigurationexception reducelronplateau conditioned metric val loss available available metric loss ihis similar instance definitely return progress bar dict val loss key see code code sample def training step self batch batch idx z true batch pred self forward z loss val self loss function pred true return loss loss val sqrt def validation step self batch batch idx z true batch lr torch tensor self optim param group lr pred self forward z loss val self loss function pred true return val loss loss val sqrt lr lr def validation epoch end self output val loss mean torch stack x val loss x output mean lr output lr log val loss val loss mean lr lr return val loss val loss mean progress bar log log log expected behavior val loss value picked progress bar environment pytorch version e g os e g linux windows installed pytorch conda pip source pip python version cuda cudnn version gpu model configuration x relevant information	2020-03-15 15:03:34	1584284614	resolved fixed	711892a0a293f7c7f951eba0907e1c0ccd2b37d8	1584624149	docs\source\optimizers.rst pytorch_lightning\core\lightning.py                                                                  
9	1161	multi-gpu ddp calls validation and testing loops too many times	using ddp multiple gpus validation test loop called entire validation dataset gpu expected behavior dataset divided appropriately across gpus using current master cloned mar ubuntu cuda python pytorch venv environment problem appears auto add sampler data loading py create distributedsampler validation test datasets	2020-03-16 18:09:55	1584382195	resolved fixed	6dfe9951e132bdc9896926557138e7a21d4cd000	1585584814	pytorch_lightning\trainer\data_loading.py                                                                    
10	1181	Additional dataloader created and discarded when training with reload_dataloaders_every_epoch	bug training reload dataloaders every epoch noticed instantiates extra dataloader training nothing run issue training chunk get loaded every epoch messing order load especially reload checkpoint would issue people generate new dataset every epoch waste computation tqdm bar also keep information first discarded dataloader screenshot number iteration whereas different size reproduce run code sample run one epoch display message every time dataloader created dataloader get instantiated first time line training loop py outside epoch loop usual time get instantiated reloading every epoch using reload dataloaders every epoch another one created start every epoch line inside loop first epoch extra one code sample import torch import pytorch lightning pl torch utils data import dataloader dataset time import sleep class minimaldataset dataset def init self index self data torch tensor index def getitem self item return self data item def len self return len self data class minimalmodule pl lightningmodule def init self super minimalmodule self init self nn torch nn linear self current index def forward self batch return self nn batch def training step self batch batch idx sleep loss self nn batch return loss loss def validation step self batch batch idx loss self nn batch return val loss loss def configure optimizers self return torch optim adam self parameter lr def train dataloader self required self current index print f initializing dataloader n self current index data loader dataloader minimaldataset self current index return data loader model minimalmodule trainer pl trainer reload dataloaders every epoch true num sanity val step val check interval max epoch trainer fit model expected behavior one dataloader created two tqdm bar show iteration dataset size second time show instead added sleep leave time observe environment pytorch version debug build cuda used build pytorch os ubuntu lts gcc version ubuntu cmake version could collect python version cuda available yes cuda runtime version could collectepoch end gpu model configuration gpu geforce rtx max q design nvidia driver version cudnn version could collect versions relevant library pip3 numpy pip3 pytorch lightning pip3 torch pip3 torchvision conda could collect additional context	2020-03-18 15:42:43	1584546163	resolved fixed	04935ea7184a50d535af96dd85a58fdc43a659b8	1585820516	CHANGELOG.md pytorch_lightning\trainer\evaluation_loop.py pytorch_lightning\trainer\trainer.py pytorch_lightning\trainer\training_loop.py                                                              
11	1201	Early stopping not working on 0.7.1	bug early stopping work anymore downgrade current dev version early stopping work code code sample def main hparams hparams early stopping yes early stopping earlystopping monitor batch mean absolute loss min delta hparams min delta patience hparams patience mode min else early stopping false model memorytest hparams trainer pl trainer val percent check early stop callback early stopping default save path src setting log dir max epoch hparams epoch trainer fit model class memorytest pl lightningmodule main testing unit experiments recurrent cells def init self hp super memorytest self init self predict col hp predict col self n datasamples hp n datasamples self dataset hp dataset self dataset rand self seq len none else self seq len hp seq len self hparams hp self learning rate hp learning rate self training loss self final loss none self model recurrentmodel hp n cell hp n layer celltype hp celltype def forward self input input len return self model input input len def training step self batch batch idx x input len batch feature self forward x input len loss f mse loss feature mean absolute loss f l1 loss feature self training loss append mean absolute loss item neptune log batch train loss loss batch mean absolute loss mean absolute loss return loss loss batch mean absolute loss mean absolute loss log neptune log def epoch end self train loss mean np mean self training loss self final loss train loss mean self training loss reset next epoch def configure optimizers self return torch optim sgd self parameter lr self learning rate pl data loader def train dataloader self train dataset dg randomdataset self predict col self n datasamples self dataset rand fix train dataset dg randomdatasetfix self predict col self n datasamples self seq len self dataset correlated train dataset dg correlateddataset self predict col self n datasamples train loader dataloader dataset train dataset batch size return train loader staticmethod def add model specific args parent parser model specific model parser argumentparser parent parent parser model parser add argument learning rate default type float model parser add argument n layer default type int model parser add argument n cell default type int model parser add argument celltype default lstm type str training specific model model parser add argument epoch default type int model parser add argument patience default type int model parser add argument min delta default type float model parser add argument early stopping default yes type str data specific model parser add argument n datasamples default type int model parser add argument seq len default type int model parser add argument dataset default rand type str model parser add argument predict col default type int return model parser expected behavior early stopping take effect	2020-03-20 22:35:06	1584743706	resolved fixed	1aba411da96ed95419d13ec1f86a0d38a232f73e	1585635866	CHANGELOG.md docs\source\early_stopping.rst pytorch_lightning\trainer\training_loop.py tests\trainer\test_callbacks.py                                                              
12	1213	Testing in dp mode uses only one of the GPUs	bug reproduce steps reproduce behavior run test without training code sample modified conference seed repo trainer trainer gpus distributed backend dp trainer test model expected behavior environment pl version pytorch version e g os e g linux ubuntu installed pytorch conda pip source pip build command used compiling source python version cuda cudnn version gpu model configuration relevant information additional context	2020-03-23 11:26:40	1584962800	resolved fixed	c869dd8b8f6301f3726df84535a3da4e9acf04ec	1585584867	CHANGELOG.md pytorch_lightning\trainer\evaluation_loop.py pytorch_lightning\trainer\trainer.py tests\test_deprecated.py                                                              
13	122	Fix appveyor build	window support priority badge fixed today keep appveyor otherwise drop project borda	2019-08-15 14:03:39	1565877819	resolved fixed	6f1d2c45fe72d7a8a637290c2e78973deb1637e0	1565883903	appveyor.yml                                                                    
14	1223	gan.py multi-gpu running problems	running gan py example trainer ngpus cause two type error trainer ngpus distributed backend dp exception occurred attributeerror nonetype object attribute detach file home user gan py line training step self discriminator self generated imgs detach fake trainer ngpus distributed backend ddp lightling log one run creates two folder version version exception caused file opt miniconda3 envs ctln gan lib python3 site package pytorch lightning callback model checkpoint py line del model o remove filepath filenotfounderror errno file directory home user pyproj dcgan lightning log version checkpoint epoch ckpt seems subprocess try create checkpoint delete ctrated one environment version python pytorch pytorch lightning	2020-03-24 14:24:01	1585059841	resolved fixed	55fdfe384537e4d43e7397306ba001ffc3474322	1590928281	pl_examples\domain_templates\generative_adversarial_net.py                                                                    
15	1236	AdvancedProfiler error	hi others pointed profiler seem work print nothing trying advancedprofiler like pytorch lightning profiler import advancedprofiler profiler advancedprofiler output filename prof txt trainer trainer profiler profiler params give following error validation sanity check traceback recent call last file users sdumitre work style training py line main hparams file users sdumitre work style training py line main trainer fit model file users sdumitre virtual p3 lib python3 site package pytorch lightning trainer trainer py line fit self run pretrain routine model file users sdumitre virtual p3 lib python3 site package pytorch lightning trainer trainer py line run pretrain routine callback metric self process output eval result file users sdumitre virtual p3 lib python3 site package pytorch lightning trainer logging py line process output callback metric k v item valueerror one element tensor converted python scalar process finished exit code pointer env torch installed pip python gpu macos thanks great lib developing	2020-03-25 19:02:05	1585162925	resolved fixed	54507f417eaf3317a798b3303c398152a4e35a18	1585508196	pytorch_lightning\__init__.py tests\test_profiler.py                                                                  
16	1262	incorrect run on the test set with overwritten validation_end and test_epoch_end	bug override validation end test epoch end trainerevaluationloopmixin evaluate work incorrectly test set suppose override actually since newbie yet figured everything work also seems seems suppose run consider line evaluation loop py first block executed look second hence second also executed validation result recorder test result mistake problem present commit inverse problem happens override present	2020-03-27 12:38:00	1585312680	resolved fixed	ebd9fc9530242e1c9b5f3093dc62ceb4185735b0	1585920332	CHANGELOG.md pytorch_lightning\trainer\evaluation_loop.py tests\trainer\test_trainer.py                                                                
17	1264	Multiple undesired checkpoints created during single epoch	bug thanks great project sent custom modelcheckpoint trainer hoping get one checkpoint epoch trainer eventually produced lot versioned checkpoint within single epoch wasting lot disk space causing confusion example shown checkpoint gan ckpt epoch ckpt ckpt epoch v0 ckpt ckpt epoch v10 ckpt ckpt epoch v11 ckpt ckpt epoch v12 ckpt ckpt epoch v13 ckpt ckpt epoch v14 ckpt ckpt epoch v15 ckpt ckpt epoch v16 ckpt ckpt epoch v17 ckpt ckpt epoch v18 ckpt ckpt epoch v19 ckpt ckpt epoch v1 ckpt ckpt epoch v20 ckpt ckpt epoch v21 ckpt minimal code used training showed reproduce exactly checkpoint callback modelcheckpoint filepath o path join gan experiment name save top k period trainer trainer checkpoint callback checkpoint callback reproduce steps reproduce behavior clone repo git clone git checkout run script train gan mnist cd learnable ai python application image generation train gan py dataset mnist latent dim dim channel batch size max epoch see generated check point checkpoint tree checkpoint multiple checkpoint within single epoch checkpoint gan ckpt epoch ckpt ckpt epoch v0 ckpt ckpt epoch v10 ckpt ckpt epoch v11 ckpt ckpt epoch v12 ckpt ckpt epoch v13 ckpt ckpt epoch v14 ckpt ckpt epoch v15 ckpt ckpt epoch v16 ckpt ckpt epoch v17 ckpt ckpt epoch v18 ckpt ckpt epoch v19 ckpt ckpt epoch v1 ckpt ckpt epoch v20 ckpt ckpt epoch v21 ckpt expected behavior one checkpoint epoch using custom modelcheckpoint pl lightningmodule simply use val loss evaulation metric thus default checkpoint functionality trainer work environment cuda gpu tesla v100 sxm2 available true version package numpy pytorch debug false pytorch version pytorch lightning tensorboard tqdm system os linux architecture elf processor x86 python version smp tue dec utc additional context related slack discussion	2020-03-27 14:14:42	1585318482	resolved fixed	09167efdb59e1be8ffe9ff7010393bff084390be	1585607822	pl_examples\multi_node_examples\multi_node_ddp_demo.py pytorch_lightning\callbacks\base.py pytorch_lightning\callbacks\model_checkpoint.py pytorch_lightning\profiler\profiler.py pytorch_lightning\trainer\distrib_data_parallel.py pytorch_lightning\trainer\distrib_parts.py pytorch_lightning\trainer\evaluation_loop.py pytorch_lightning\trainer\trainer.py pytorch_lightning\trainer\training_io.py pytorch_lightning\trainer\training_loop.py tests\base\__init__.py tests\base\mixins.py tests\base\models.py tests\test_profiler.py tests\trainer\test_trainer.py                                        
18	1290	bug(logger): wandb fails on sweep	bug using wandb sweep hyperparameters search get error wandb error attempted change value key dropout std reason ran wandb logger log hyperparams params guess problem floating point number high accuracy	2020-03-30 11:08:50	1585566530	resolved fixed	f3d139e90f9212813c4f5e6de777bdef9dfe7635	1587738564	CHANGELOG.md pytorch_lightning\loggers\wandb.py tests\loggers\test_wandb.py                                                                
