id,bug_id,summary,description,report_time,report_timestamp,status,commit,commit_timestamp,files
219,37230,tf.function second derivative error,please make sure bug per github policy address code doc bug performance issue feature request build installation issue github tag bug template system information written custom code opposed using stock example script provided tensorflow yes os platform distribution e g linux ubuntu macos mojave mobile device e g iphone pixel samsung galaxy issue happens mobile device n tensorflow installed source binary tensorflow version use command binary v2 rc2 python version bazel version compiling source python gcc compiler version compiling source cuda cudnn version gpu model memory describe current behavior custom function need use slicing loop first order derivative working properly second order derivative give error error occurs function decorated tf function simplified code reproduce error describe expected behavior standalone code reproduce issue provide reproducible test case bare minimum necessary generate problem possible please share link colab jupyter notebook import tensorflow tf x tf random uniform minval maxval seed dtype tf float32 tf function def x return x tf function def g x z sum tf constant dtype tf float32 tf range x shape z sum tf add z sum x return z sum tf gradienttape watch x tf gradienttape tt tt watch x loss g x jac tt gradient loss x hess gradient jac x info log include log source code would helpful diagnose problem including tracebacks please include full traceback large log file attached invalidargumenterror traceback recent call last anaconda3 envs bys lib python3 site package tensorflow core python framework ops py get attr self name c api util tf buffer buf c api tf operationgetattrvalueproto self c op name buf data c api tf getbuffer buf invalidargumenterror operation gradient grad grad attr named xlacompile handling exception another exception occurred valueerror traceback recent call last anaconda3 envs bys lib python3 site package tensorflow core python ops gradient util py maybecompile scope op func grad fn try xla compile op get attr xlacompile xla separate compiled gradient op get attr anaconda3 envs bys lib python3 site package tensorflow core python framework ops py get attr self name convert valueerror backwards compatibility raise valueerror str e x attr value pb2 attrvalue valueerror operation gradient grad grad attr named xlacompile handling exception another exception occurred invalidargumenterror traceback recent call last anaconda3 envs bys lib python3 site package tensorflow core python framework ops py get attr self name c api util tf buffer buf c api tf operationgetattrvalueproto self c op name buf data c api tf getbuffer buf invalidargumenterror operation gradient tensorlistpushback grad tensorlistpopback attr named xlacompile handling exception another exception occurred valueerror traceback recent call last anaconda3 envs bys lib python3 site package tensorflow core python ops gradient util py maybecompile scope op func grad fn try xla compile op get attr xlacompile xla separate compiled gradient op get attr anaconda3 envs bys lib python3 site package tensorflow core python framework ops py get attr self name convert valueerror backwards compatibility raise valueerror str e x attr value pb2 attrvalue valueerror operation gradient tensorlistpushback grad tensorlistpopback attr named xlacompile handling exception another exception occurred valueerror traceback recent call last anaconda3 envs bys lib python3 site package tensorflow core python framework op def library py apply op helper op type name name keywords ref input arg ref preferred dtype default dtype except typeerror err anaconda3 envs bys lib python3 site package tensorflow core python framework ops py convert tensor value dtype name ref preferred dtype dtype hint ctx accepted result type ret none ret conversion func value dtype dtype name name ref ref anaconda3 envs bys lib python3 site package tensorflow core python framework constant op py constant tensor conversion function v dtype name ref ref return constant v dtype dtype name name anaconda3 envs bys lib python3 site package tensorflow core python framework constant op py constant value dtype shape name return constant impl value dtype shape name verify shape false allow broadcast true anaconda3 envs bys lib python3 site package tensorflow core python framework constant op py constant impl value dtype shape name verify shape allow broadcast value dtype dtype shape shape verify shape verify shape allow broadcast allow broadcast dtype value attr value pb2 attrvalue type tensor value tensor dtype anaconda3 envs bys lib python3 site package tensorflow core python framework tensor util py make tensor proto value dtype shape verify shape allow broadcast value none raise valueerror none value supported dtype provided force numpy array type valueerror none value supported handling exception another exception occurred valueerror traceback recent call last anaconda3 envs bys lib python3 site package tensorflow core python framework op def library py apply op helper op type name name keywords observed ops convert tensor value ref input arg ref dtype name except valueerror err anaconda3 envs bys lib python3 site package tensorflow core python framework ops py convert tensor value dtype name ref preferred dtype dtype hint ctx accepted result type ret none ret conversion func value dtype dtype name name ref ref anaconda3 envs bys lib python3 site package tensorflow core python framework constant op py constant tensor conversion function v dtype name ref ref return constant v dtype dtype name name anaconda3 envs bys lib python3 site package tensorflow core python framework constant op py constant value dtype shape name return constant impl value dtype shape name verify shape false allow broadcast true anaconda3 envs bys lib python3 site package tensorflow core python framework constant op py constant impl value dtype shape name verify shape allow broadcast value dtype dtype shape shape verify shape verify shape allow broadcast allow broadcast dtype value attr value pb2 attrvalue type tensor value tensor dtype anaconda3 envs bys lib python3 site package tensorflow core python framework tensor util py make tensor proto value dtype shape verify shape allow broadcast value none raise valueerror none value supported dtype provided force numpy array type valueerror none value supported handling exception another exception occurred valueerror traceback recent call last tt watch x loss g x jac tt gradient loss x hess gradient jac x anaconda3 envs bys lib python3 site package tensorflow core python eager backprop py gradient self target source output gradient unconnected gradient output gradient output gradient source raw flat source raw unconnected gradient unconnected gradient self persistent anaconda3 envs bys lib python3 site package tensorflow core python eager imperative grad py imperative grad tape target source output gradient source raw unconnected gradient output gradient source raw compat str unconnected gradient value anaconda3 envs bys lib python3 site package tensorflow core python eager function py backward function wrapper args break return backward call flat pylint disable protected access processed args remapped capture return backward function wrapper recorded output anaconda3 envs bys lib python3 site package tensorflow core python eager function py call flat self args captured input cancellation manager possible gradient type executing eagerly forward function args tangent forward backward forward executing eagerly flat output forward function call anaconda3 envs bys lib python3 site package tensorflow core python eager function py forward self builds retrieves forward function call forward function self function forward self inference args self input tangent return forward function self inference args self input tangent anaconda3 envs bys lib python3 site package tensorflow core python eager function py forward self inference args input tangent self forward self forward graph self backward self forwardprop output index self num forwardprop output self forward backward function inference args input tangent return self forward anaconda3 envs bys lib python3 site package tensorflow core python eager function py forward backward function self inference args input tangent output self func graph output self num inference output return self build function output output inference args input tangent anaconda3 envs bys lib python3 site package tensorflow core python eager function py build function output self output inference args input tangent self func graph input grad y gradient wrt output src graph self func graph capture forward anaconda3 envs bys lib python3 site package tensorflow core python ops gradient util py gradientshelper y x grad y name colocate gradient ops gate gradient aggregation method stop gradient unconnected gradient src graph function grad maybecompile grad scope op func call lambda grad fn op grad else function call ops add symbolicgradient anaconda3 envs bys lib python3 site package tensorflow core python ops gradient util py maybecompile scope op func grad fn xla scope op get attr xlascope decode except valueerror return grad fn exit early xla compile anaconda3 envs bys lib python3 site package tensorflow core python ops gradient util py function grad maybecompile grad scope op func call lambda grad fn op grad else function call ops add symbolicgradient anaconda3 envs bys lib python3 site package tensorflow core python ops v2 py whilegrad op grad body grad graph args create grad func y x non none grad cond graph body graph util unique grad fn name body graph name op maximum iteration body grad graph op need rewrite anaconda3 envs bys lib python3 site package tensorflow core python ops v2 py create grad func y x grad cond graph body graph name op maximum iteration func graph whilebodygradfuncgraph name cond graph body graph maximum iteration op body graph input body graph output update list output tensor corresponding captured anaconda3 envs bys lib python3 site package tensorflow core python framework func graph py func graph py func name python func args kwargs signature func graph autograph autograph option add control dependency arg name op return value collection capture value override flat arg shape converted func func output python func func args func kwargs invariant func output contains tensors compositetensors anaconda3 envs bys lib python3 site package tensorflow core python ops v2 py args grad func graph func graph module func graph py func name lambda args grad fn y x args body graph args func graph whilebodygradfuncgraph name cond graph body graph anaconda3 envs bys lib python3 site package tensorflow core python ops v2 py grad fn y x args func graph grad out gradient util gradientshelper y x grad y grad y src graph func graph unconnected gradient zero todo b handle case grad out none e g anaconda3 envs bys lib python3 site package tensorflow core python ops gradient util py gradientshelper y x grad y name colocate gradient ops gate gradient aggregation method stop gradient unconnected gradient src graph function grad maybecompile grad scope op func call lambda grad fn op grad else function call ops add symbolicgradient anaconda3 envs bys lib python3 site package tensorflow core python ops gradient util py maybecompile scope op func grad fn xla scope op get attr xlascope decode except valueerror return grad fn exit early xla compile anaconda3 envs bys lib python3 site package tensorflow core python ops gradient util py function grad maybecompile grad scope op func call lambda grad fn op grad else function call ops add symbolicgradient anaconda3 envs bys lib python3 site package tensorflow core python ops list ops py popbackgrad op dlist delement element shape gen list ops tensor list element shape op output shape type dtypes int32 return gen list ops tensor list push back dlist delement none anaconda3 envs bys lib python3 site package tensorflow core python ops gen list ops py tensor list push back input handle tensor name op output op def library apply op helper tensorlistpushback input handle input handle tensor tensor name name result output execute must record gradient anaconda3 envs bys lib python3 site package tensorflow core python framework op def library py apply op helper op type name name keywords raise valueerror tried convert tensor failed error input name err prefix input op type match input name op type name observed valueerror tried convert tensor tensor failed error none value supported,2020-03-02 12:43:36,1583153016,resolved fixed,cf09044d9e7b232080f95f0f910a6803904df1de,1585610529,tensorflow\python\eager\pywrap_gradient_exclusions.cc tensorflow\python\kernel_tests\list_ops_test.py tensorflow\python\ops\list_ops.py                                                        
220,37480,'third_party/tensorflow/compiler/aot:codegen_test' No such directory found,thank submitting tensorflow documentation issue per github policy address code doc bug performance issue feature request build installation issue github tensorflow doc open source get involved read documentation contributor guide url issue please provide link documentation entry example description issue need changing update golden file flip update golden true run following bazel test test strategy local third party tensorflow compiler aot codegen test clear description line wanted update golden file given directory present third party library example someone use method useful correct link link source code correct parameters defined parameter defined formatted correctly returns defined return value defined raises listed defined error defined example usage example usage example see api guide write testable usage example request visuals applicable currently visuals clarify content submit pull request planning also submit pull request fix issue see doc contributor guide doc api guide doc style guide,2020-03-10 14:31:49,1583850709,resolved fixed,282828af67de29d13dd2c69d96413c030b02543c,1585036808,tensorflow\compiler\aot\codegen_test.cc                                                            
221,37777,It seems that Tensorflow needs a check for the unreasonable parameter `input_dim=0` in the layer `Embedding`.,system information written custom code opposed using example directory os platform distribution e g linux ubuntu windows linux ubuntu tensorflow version cpu using pip install tensorflow download directly python version cuda cudnn version gpu model memory describe current behavior build model illogical parameter input dim layer embedding tensorflow us unreasonably parameter build even save model detailed performance building model shown following picture key insight sum input dim output dim unreasonable corner case tensorflow seems lack checking corner case may lead tensorflow user create even save wrong model bring potential risk subsequent usage code reproduce issue import numpy np import tensorflow kera layer l tensorflow kera import model input import tensorflow import o print tensorflow version kwargs input dim also set input dim test output dim mask zero true input np random random layer l embedding kwargs x input batch shape input shape layer x bk model model x model path o path join mode h5 bk model save model path bk model print finish,2020-03-21 10:12:31,1584785551,resolved fixed,f61175812426009a4c96e51befb2951612990903,1585247122,tensorflow\python\keras\layers\embeddings.py                                                            
222,37983,Calling next with a default value on an exhausted Dataset iterator raises an OutOfRangeError in graph mode,system information written custom code yes os platform distribution windows tensorflow installed binary describe current behavior next iterator default supposed give next element iterator value given default iterator end however using construction function tf function default value returned error tensorflow python framework error impl outofrangeerror produced trying call next iterator end running code eager mode default value returned expected describe expected behavior graph mode default value returned end iterator standalone code reproduce issue import tensorflow tf x tf convert tensor d tf data dataset tensor slice x dsi iter d tf function remove get expected behaviour def func range tf print next dsi func output see full stacktrace w tensorflow core common runtime base collective executor cc basecollectiveexecutor startabort range end sequence node iteratorgetnext expected output stacktrace txt,2020-03-27 18:02:30,1585332150,resolved fixed,95ea3404528afcb1a74dd5f0946ea8d17beda28b,1586647842,tensorflow\python\autograph\operators\py_builtins.py tensorflow\python\autograph\operators\py_builtins_test.py                                                          
223,3824,Unclear documentation and behavior for sampler in Tensorflow,sampler implemented tensorflow e g tf nn fixed unigram candidate sampler behavior well defined document instance would expect label specified true class excluded sampling pool sampling conducted batch according experiment neither true consider following code import tensorflow tf label matrix tf reshape tf constant dtype tf int64 sampled id tf nn fixed unigram candidate sampler true class label matrix num true num sampled unique true range max distortion unigrams range init tf initialize variable tf session sess sess run init print sess run sampled id output actually belongs set true class also output dimension basically mean sampling conducted batch someone help clarify,2016-08-15 18:34:24,1471286064,resolved fixed,71319c58a3436fbd7081e49c52878dd1ba1772b5,1493418838,tensorflow\core\ops\candidate_sampling_ops.cc tensorflow\python\ops\candidate_sampling_ops.py                                                          
224,38349,`nan` gradient when `tf.where` is used,please make sure bug per github policy address code doc bug performance issue feature request build installation issue github tag bug template system information written custom code opposed using stock example script provided tensorflow yes os platform distribution e g linux ubuntu debian gnu linux buster mobile device e g iphone pixel samsung galaxy issue happens mobile device tensorflow installed source binary binary tensorflow version use command v2 rc2 ge5bf8de v1 g38797a1c8b dev20200407 python version bazel version compiling source gcc compiler version compiling source cuda cudnn version gpu model memory collect information using environment capture script also obtain tensorflow version tf tf describe current behavior well defined function tf nan gradient point tf inactive branch undefined describe expected behavior inactive branch ignored gradient calculation standalone code reproduce issue provide reproducible test case bare minimum necessary generate problem possible please share link colab jupyter notebook import tensorflow tf ex range x tf convert tensor ex tf gradienttape g g watch x tf x x tf math log1p x tf x x tf math log x tf x x x dy dx g gradient x print f x dy dx x dy dx function well defined positive value used testing still show gradient point equal dy dx dy dx dy dx dy dx nan dy dx dy dx info log include log source code would helpful diagnose problem including tracebacks please include full traceback large log file attached,2020-04-08 09:30:26,1586338226,resolved fixed,d6c0858665de6036de24991b29d74b182cfcf5ae,1595662081,tensorflow\python\ops\array_ops.py                                                            
