id,bug_id,summary,description,report_time,report_timestamp,status,commit,commit_timestamp,files
83,22438,InvalidArgumentError when SparseTensorValue is not ordered by row then col,system information written custom code opposed using stock example script provided tensorflow yes os platform distribution e g linux ubuntu mac os mobile device e g iphone pixel samsung galaxy issue happens mobile device tensorflow installed source binary binary tensorflow version use command v1 rc1 g656e7a2b34 python version bazel version compiling source gcc compiler version compiling source cuda cudnn version gpu model memory exact command reproduce python bug py describe problem feed sparsetensorvalue tf data dataset tensor slice index lexicographically sorted row col get invalidargumenterror maybe could said doc error provide clearer message hard guess index order meant index provided lexicographic order finally saw explained sparsetensor doc feel said sparsetensorvalue doc well source code log scipy sparse import csr matrix import tensorflow tf import numpy np np array first observation two slicing operation provide different ordering csr matrix tocoo print row col csr matrix tocoo print row col entry np column stack row col data ordering np arange len data uncomment following line fix error ordering np lexsort col row sort row col x train tf sparsetensorvalue index entry ordering value entry ordering dense shape shape dataset tf data dataset tensor slice x train iterator dataset make initializable iterator x sample iterator get next tf session sess sess run iterator initializer print sess run x sample traceback recent call last file users jilljenn code vae venv lib python3 site package tensorflow python client session py line call return fn args file users jilljenn code vae venv lib python3 site package tensorflow python client session py line run fn option feed dict fetch list target list run metadata file users jilljenn code vae venv lib python3 site package tensorflow python client session py line call tf sessionrun run metadata tensorflow python framework error impl invalidargumenterror index order node serializemanysparse serializemanysparse dt int64 type dt variant device job localhost replica task device cpu tensor sparsetensor index tensor sparsetensor value tensor sparsetensor dense shape handling exception another exception occurred traceback recent call last file bug py line sess run iterator initializer file users jilljenn code vae venv lib python3 site package tensorflow python client session py line run run metadata ptr file users jilljenn code vae venv lib python3 site package tensorflow python client session py line run feed dict tensor option run metadata file users jilljenn code vae venv lib python3 site package tensorflow python client session py line run run metadata file users jilljenn code vae venv lib python3 site package tensorflow python client session py line call raise type e node def op message tensorflow python framework error impl invalidargumenterror index order node serializemanysparse serializemanysparse dt int64 type dt variant device job localhost replica task device cpu tensor sparsetensor index tensor sparsetensor value tensor sparsetensor dense shape caused op serializemanysparse defined file bug py line dataset tf data dataset tensor slice x train file users jilljenn code vae venv lib python3 site package tensorflow python data ops dataset ops py line tensor slice return tensorslicedataset tensor file users jilljenn code vae venv lib python3 site package tensorflow python data ops dataset ops py line init self tensor sparse serialize many sparse tensor tensor file users jilljenn code vae venv lib python3 site package tensorflow python data util sparse py line serialize many sparse tensor tensor nest flatten tensor file users jilljenn code vae venv lib python3 site package tensorflow python data util sparse py line tensor nest flatten tensor file users jilljenn code vae venv lib python3 site package tensorflow python ops sparse ops py line serialize many sparse type type file users jilljenn code vae venv lib python3 site package tensorflow python ops gen sparse ops py line serialize many sparse type type name name file users jilljenn code vae venv lib python3 site package tensorflow python framework op def library py line apply op helper op def op def file users jilljenn code vae venv lib python3 site package tensorflow python util deprecation py line new func return func args kwargs file users jilljenn code vae venv lib python3 site package tensorflow python framework ops py line create op op def op def file users jilljenn code vae venv lib python3 site package tensorflow python framework ops py line init self traceback tf stack extract stack invalidargumenterror see traceback index order node serializemanysparse serializemanysparse dt int64 type dt variant device job localhost replica task device cpu tensor sparsetensor index tensor sparsetensor value tensor sparsetensor dense shape,2018-09-21 07:00:58,1537513258,resolved fixed,eb625fb51a302dc812c97879697642db9aa8cfc1,1565287308,tensorflow\core\util\sparse\sparse_tensor.h tensorflow\core\util\sparse\sparse_tensor_test.cc                                                          
84,23083,Documentation for learning_rate_power in the FTRL optimizer,please make sure documentation issue per github policy address code doc bug performance issue feature request build installation issue github tag doc template system information tensorflow version doc link probably silly small issue doc ftrl optimizer describe interacts tried figure based source actually find learning rate power used code l2 shrinkage regularization strength detailed explanation equation something similar learning rate power would nice,2018-10-18 20:26:27,1539894387,resolved fixed,5097def5847270353d7d8a37eacbd0f85e98f2a0,1540428903,tensorflow\python\training\ftrl.py                                                            
85,23195,Segfault reading dataset more than once (`make_batched_features_dataset`),system information written custom code opposed using stock example script provided tensorflow os platform distribution e g linux ubuntu macos mojave mobile device e g iphone pixel samsung galaxy issue happens mobile device na tensorflow installed source binary binary pip tensorflow version use command v1 rc2 gc19e29306c python version bazel version compiling source na gcc compiler version compiling source na cuda cudnn version na gpu model memory na gist full output tool tf env collect sh exact command reproduce wget python gistfile1 txt describe current behavior current behavior included script segfaults sigsegv describe expected behavior expected behavior segfault version segfault checked lower version code reproduce issue see full script reproduces issue along two different code path segfault occurs reading dataset second time first read work expected reference two code sample produce datasets cause segfault second read dataset make batched feature dataset file pattern data file batch size feature feature spec also dug make batched feature dataset minified repro tensorflow contrib data python ops import parsing ops tensorflow python data ops import reader dataset dataset tensor slice data file interleave reader tfrecorddataset cycle length batch batch size apply parsing ops parse example dataset feature spec please let know anything else provide help blocking u upgrading latest tensorflow version spotify spotify tensorflow,2018-10-23 20:21:54,1540326114,resolved fixed,95de98b58a35aaac2804716a70979e68596f3dae,1540949771,tensorflow\core\kernels\data\parse_example_dataset_op.cc tensorflow\python\data\experimental\kernel_tests\parse_example_dataset_test.py tensorflow\python\framework\test_util.py                                                        
86,23443,Python client link is broken,please make sure documentation issue per github policy address code doc bug performance issue feature request build installation issue github tag doc template system information tensorflow version unrelated using github ui viewing code doc link link give welcome contribution user able update submit pr use doc style guide fix doc issue,2018-11-01 23:45:42,1541115942,resolved fixed,09f82cbffdcaf5298bcbd4703c18b64ddd287aab,1541201957,tensorflow\contrib\crf\__init__.py tensorflow\contrib\framework\__init__.py tensorflow\contrib\layers\__init__.py tensorflow\contrib\learn\__init__.py tensorflow\contrib\rnn\__init__.py tensorflow\contrib\util\__init__.py tensorflow\lite\g3doc\convert\cmdline_examples.md tensorflow\python\client\client_lib.py tensorflow\python\debug\__init__.py tensorflow\python\lib\io\python_io.py tensorflow\python\ops\array_ops.py tensorflow\python\ops\check_ops.py tensorflow\python\ops\control_flow_ops.py tensorflow\python\ops\functional_ops.py tensorflow\python\ops\session_ops.py tensorflow\python\ops\sparse_ops.py tensorflow\python\ops\state_ops.py tensorflow\python\ops\string_ops.py                          
87,23449,Bug in tensorflow lite java wrapper,file line function output tensor length used instead inputtensors length,2018-11-02 07:25:15,1541143515,resolved fixed,816426f66a9b3edbbdf4203684f7753b2974866d,1541699007,tensorflow\lite\java\BUILD tensorflow\lite\java\src\main\java\org\tensorflow\lite\NativeInterpreterWrapper.java tensorflow\lite\java\src\test\java\org\tensorflow\lite\InterpreterFlexTest.java tensorflow\lite\java\src\test\java\org\tensorflow\lite\InterpreterTest.java                                                      
88,23748,tensorflow.keras Dense layers complain if the input is a sparse Input layer.,system information written custom code opposed using stock example script provided tensorflow yes os platform distribution e g linux ubuntu osx mojave mobile device e g iphone pixel samsung galaxy issue happens mobile device na tensorflow installed source binary binary tensorflow version use command v1 rc1 g656e7a2b34 python version bazel version compiling source na gcc compiler version compiling source cuda cudnn version gpu model memory collect information using environment capture script also obtain tensorflow version python c import tensorflow tf print tf git version tf version describe current behavior see ran osx mojave macbook pro early ipython running python tensorflow tensorflow kera model import model anaconda envs dssm lib python3 importlib bootstrap py runtimewarning compiletime version module tensorflow python framework fast tensor util match runtime version return f args kwds tensorflow kera layer import input dense input sparse true dense attributeerror traceback recent call last dense anaconda envs dssm lib python3 site package tensorflow python kera engine base layer py call self input args kwargs check input assumption set layer building e g input rank self assert input compatibility input input list self dtype none try anaconda envs dssm lib python3 site package tensorflow python kera engine base layer py assert input compatibility self input spec min ndim none spec max ndim none x shape ndims none raise valueerror input str input index layer self name incompatible layer attributeerror sparsetensor object attribute shape describe expected behavior using normal keras expect error trying model compile subsequently without issue code reproduce issue see code snippet info log,2018-11-14 16:19:40,1542212380,resolved fixed,74195b50fb5e1f22eb95ffd1646b4b0ceca2ea9b,1581017927,tensorflow\python\client\session_test.py tensorflow\python\framework\sparse_tensor.py tensorflow\python\keras\engine\training.py tensorflow\python\keras\utils\composite_tensor_support_test.py tensorflow\python\keras\utils\tf_utils.py tensorflow\python\kernel_tests\sparse_ops_test.py tensorflow\python\ops\array_ops.py                                                
89,23878,Bug: instantiating dynamic_rnn with tf.int32 in input and state raises TypeError,system information os platform os x custom code tensorflow version python version describe current behavior tensorflow raise typeerror creating dynamic rnn tf int32 type input state changing type tf float32 error raised describe expected behavior ideally dynamic rnn support tf in32 type reason instantiating dynamic rnn tf int32 type input state allowed custom error raised code reproduce issue code reproduces error import tensorflow tf x tf placeholder tf int32 none cell tf nn rnn cell lstmcell dtype tf int32 output state tf nn dynamic rnn cell cell input x dtype tf int32 code import tensorflow tf x tf placeholder tf float32 none cell tf nn rnn cell lstmcell dtype tf float32 output state tf nn dynamic rnn cell cell input x dtype tf float32 note change dtype info log traceback typeerror traceback recent call last x tf placeholder tf int32 none cell tf nn rnn cell lstmcell dtype tf int32 output state tf nn dynamic rnn cell cell input x dtype tf int32 initial state state jonassucks3 lib python3 site package tensorflow python ops rnn py dynamic rnn cell input sequence length initial state dtype parallel iteration swap memory time major scope swap memory swap memory sequence length sequence length dtype dtype outputs dynamic rnn loop always shaped time batch depth jonassucks3 lib python3 site package tensorflow python ops rnn py dynamic rnn loop cell input initial state parallel iteration swap memory sequence length dtype parallel iteration parallel iteration maximum iteration time step swap memory swap memory unpack final output using output tuples jonassucks3 lib python3 site package tensorflow python ops control flow ops py loop cond body loop var shape invariant parallel iteration back prop swap memory name maximum iteration return structure ops add collection ops graphkeys context loop context result loop context buildloop cond body loop var shape invariant return structure maximum iteration none return result jonassucks3 lib python3 site package tensorflow python ops control flow ops py buildloop self pred body loop var shape invariant return structure ops get default graph mutation lock pylint disable protected access original body result exit var self buildloop pred body original loop var loop var shape invariant finally self exit jonassucks3 lib python3 site package tensorflow python ops control flow ops py buildloop self pred body original loop var loop var shape invariant flat sequence var body tensor array pre summary ops get collection ops graphkeys summary collection pylint disable protected access body result body packed var body post summary ops get collection ops graphkeys summary collection pylint disable protected access nest sequence body result jonassucks3 lib python3 site package tensorflow python ops control flow ops py lv cond lambda lv pylint disable g long lambda math ops logical maximum iteration orig cond lv body lambda lv orig body lv context executing eagerly jonassucks3 lib python3 site package tensorflow python ops rnn py time step time output ta state skip conditionals true else output new state call cell keras cell always wrap state list even single tensor jonassucks3 lib python3 site package tensorflow python ops rnn py kera rnn cell nest sequence state state state call cell lambda cell input state sequence length none jonassucks3 lib python3 site package tensorflow python ops rnn cell impl py call self input state scope args kwargs method see class docstring detail return base layer layer call self input state scope scope args kwargs jonassucks3 lib python3 site package tensorflow python layer base py call self input args kwargs actually call layer output super layer self call input args kwargs context executing eagerly jonassucks3 lib python3 site package tensorflow python kera engine base layer py call self input args kwargs deferred mode self call true output self call input args kwargs self call false output none jonassucks3 lib python3 site package tensorflow python ops rnn cell impl py call self input state sigmoid self w diag c prev self activation j else c sigmoid f self forget bias c prev sigmoid self activation j typeerror unsupported operand type tensor float,2018-11-20 11:31:19,1542713479,resolved fixed,36304bc4ceb6140e470420b65ce470092fc47ab2,1545087042,tensorflow\python\kernel_tests\rnn_test.py tensorflow\python\ops\rnn_cell_impl.py                                                          
90,23924,Memory leak when using tf.contrib.data.unbatch(),system information written custom code opposed using stock example script provided tensorflow os platform distribution e g linux ubuntu linux ubuntu mobile device e g iphone pixel samsung galaxy issue happens mobile device tensorflow installed source binary binary tensorflow version use command v1 ga6d8ffae09 python version python anaconda inc bazel version compiling source gcc compiler version compiling source cuda cudnn version gpu model memory describe current behavior memory usage continuously increase using tf contrib data unbatch describe expected behavior memory usage increase code reproduce issue absl import app absl import flag absl import logging import tensorflow tf flags flag flags flag define integer epoch flag define boolean use unbatch false def create dataset input holder dataset tf data dataset tensor slice input holder def generate random tensor size return tf random uniform size size dtype tf float32 dataset dataset map generate random tensor flags use unbatch dataset dataset apply tf contrib data unbatch else dataset dataset flat map lambda x tf data dataset tensor slice x output dataset becomes single element tuple w dataset dataset map lambda x x return dataset def main tf session sess size holder tf placeholder tf int32 shape none dataset create dataset size holder iterator dataset make initializable iterator get next iterator get next range flags epoch logging info epoch sess run iterator initializer feed dict size holder try true array sess run get next logging info generated array shape except tf error outofrangeerror pas name main app run main memory usage increase use unbatch nouse unbatch memory usage increase info log seems like call missing unbatchdatasetop,2018-11-22 14:45:32,1542897932,resolved fixed,bb425754adacc784c2ad50ed94307eaa03626b41,1543259339,tensorflow\core\kernels\data\unbatch_dataset_op.cc                                                            
91,23987,LARSOptimizer does not initialize _learning_rate_tensor and _momentum_tensor,please make sure bug per github policy address code doc bug performance issue feature request build installation issue github tag bug template system information written custom code opposed using stock example script provided tensorflow os platform distribution linux ubuntu tensorflow installed binary tensorflow version tag python version cpu mode describe current behavior larsoptimizer object attribute learning rate tensor code reproduce issue tensorflow tensorflow contrib opt python training lars optimizer test py,2018-11-27 03:10:14,1543288214,resolved fixed,6d3d0de39f3eaecdbf7fbdb52a7a02b2539efeeb,1543288689,tensorflow\contrib\opt\python\training\lars_optimizer.py                                                            
92,24286,wrong command for cloning tensorflow in TF for microcontroller doc,please make sure documentation issue per github policy address code doc bug performance issue feature request build installation issue github tag doc template system information tensorflow version master doc link describe documentation issue getting started chapter command cloning tensorflos download tensorflow source git clone git clone welcome contribution user able update submit pr use doc style guide fix doc issue yes,2018-12-11 08:38:38,1544517518,resolved fixed,caf2d701d27bf5b2e9378db5dfa63e08054ff497,1545271635,tensorflow\lite\experimental\micro\README.md                                                            
93,24414,ppc64le: no_mkl_dnn_contraction_kernel define causes build failure,please make sure build installation issue per github policy address code doc bug performance issue feature request build installation issue github tag build template system information os platform distribution e g linux ubuntu ubuntu ppc64le mobile device e g iphone pixel samsung galaxy issue happens mobile device n tensorflow installed source binary source tensorflow version master python version installed using virtualenv pip conda source bazel version compiling source gcc compiler version compiling source cuda cudnn version gpu model memory v100 recent commit changed default contraction kernel mkl based code added non intel platform avoid mkl error provide exact sequence command step executed running problem basic build bazel build tensorflow tool pip package build pip package info log include log source code would helpful diagnose problem including tracebacks please include full traceback large log file attached error home jenkins workspace tensorflow ppc64le gpu build tensorflow core kernel build illegal ambiguous match configurable attribute deps tensorflow core kernel eigen contraction kernel tensorflow linux ppc64le tensorflow core kernel mkldnn contraction kernel multiple match allowed unless one unambiguously specialized error analysis target tensorflow tool pip package build pip package failed build aborted home jenkins workspace tensorflow ppc64le gpu build tensorflow core kernel build illegal ambiguous match configurable attribute deps tensorflow core kernel eigen contraction kernel tensorflow linux ppc64le tensorflow core kernel mkldnn contraction kernel multiple match allowed unless one unambiguously specialized end multiple match select call defines select tensorflow android tensorflow arm tensorflow io tensorflow linux ppc64le mkldnn contraction kernel condition default tensorflow use custom contraction kernel tensorflow use mkldnn contraction kernel either arch specific entry select call removed mkldnn contraction kernel entry removed work follow proposed patch set,2018-12-18 06:06:14,1545113174,resolved fixed,1a26797203e62390623756fd67e69e7665b69389,1554051161,tensorflow\core\kernels\BUILD                                                            
94,24598,Potential tf.boolean_mask bug when the mask array is empty,system information os platform distribution windows tensorflow installed source binary binary tensorflow version use command python version cuda cudnn version v8 gpu model memory geforce gtx actually experiencing almost similar problem like thread want partition minibatch different part process parallel using different computation unit stitch back together however time used instead partition operation since latter run problem one partition empty code copy paste reproducible import tensorflow tf import numpy np def build conv layer input filter size num input channel num output channel name suffix ok conv weight tf variable tf truncated normal filter size filter size num input channel num output channel stddev dtype tf float32 ok conv bias tf variable tf constant shape num output channel dtype tf float32 conv tf nn conv2d input conv weight stride padding relu tf nn relu tf nn bias add conv conv bias pool tf nn max pool relu ksize stride padding return pool batch size child count channel count datatensor tf placeholder tf float32 shape none name datatensor index tensor tf placeholder name index tensor dtype tf int32 batch size tensor tf placeholder name batch size tensor dtype tf int32 condition index list partition list mask list child index range child count mask index tf reshape index tensor child index condition index tf boolean mask tf range batch size tensor mask index partition tf boolean mask datatensor mask index mask list append mask index condition index list append condition index partition list append partition transformed list build conv layer input part filter size num input channel num output channel part partition list squared list tf square part part partition list stitched conv transform tf dynamic stitch index condition index list data transformed list stitched square transform tf dynamic stitch index condition index list data squared list sum tf reduce sum stitched square transform grad tf gradient sum datatensor sess tf session sample np random uniform size batch size index arr np zero shape batch size child count dtype np int32 index arr index arr np array index arr np array feed dict datatensor sample batch size tensor batch size index tensor np argmax np random uniform size globalconstants eval batch size child count axis index tensor index arr output output extend mask list output extend transformed list output extend squared list output append stitched conv transform output append stitched square transform output append sum output append grad init tf global variable initializer sess run init range result sess run output feed dict feed dict assert np allclose result sample print runned format disappointment tf boolean mask run similar problem index arr contains reference least one partition produce empty array partition result loop end run correctly time program crash following error internalerror see traceback whereop could launch cub devicereduce sum count number true nonzero index temp storage byte status invalid configuration argument node boolean mask wheret dt int32 device job localhost replica task device gpu node dynamicstitch recvclient terminated false recv device job localhost replica task device cpu send device job localhost replica task device gpu send device incarnation tensor name edge dynamicstitch tensor type dt float device job localhost replica task device cpu think error underlying problem crash receives empty index array since could using mechanism cub library whatever cub error also occurs succesfull iteration like one could reason,2018-12-27 11:53:09,1545911589,resolved fixed,961e9f4505dff0c5a91d12b1f4e476b3cf2d295d,1545955857,tensorflow\core\kernels\where_op.cc tensorflow\core\kernels\where_op.h                                                          
