id,bug_id,summary,description,report_time,report_timestamp,status,commit,commit_timestamp,files
165,30574,Decode_wav sample rate output cannot be passed to tf.signal.linear_to_mel_weight_matrix,system information written custom code opposed using stock example script provided tensorflow combined output decode wav sample signal mfccs log mel spectrogram os platform distribution e g linux ubuntu windows mobile device e g iphone pixel samsung galaxy issue happens mobile device tensorflow installed source binary conda binary tensorflow version use command dev20190702 git version unknown python version bazel version compiling source gcc compiler version compiling source cuda cudnn version gpu model memory surface book nvidia gpu describe current behavior output decode wav tuple wav data sample rate sample rate int32 linear mel weight matrix expects float32 sample rate sample rate cast using tf cast sample rate float32 typeerror thrown message typeerror using tf tensor python bool allowed use none instead test tensor defined use tensorflow ops tf cond execute subgraphs conditioned value tensor describe expected behavior sample rate output decode wav used input linear mel weight matrix code reproduce issue provide reproducible test case bare minimum necessary generate problem import tensorflow tf def load mel file path tensor pcm sample rate tf audio decode wav path tensor sr f tf cast sample rate tf float32 mismatch type output decode wav input linear mel weight matrix print pcm sample rate sr f point stft frame m overlap stfts tf signal stft pcm frame length frame step fft length spectrogram tf ab stfts warp linear scale spectrogram mel scale num spectrogram bin stfts shape lower edge hertz upper edge hertz num mel bin linear mel weight matrix tf signal linear mel weight matrix num mel bin num spectrogram bin sr f lower edge hertz upper edge hertz mel spectrogram tf tensordot spectrogram linear mel weight matrix mel spectrogram set shape spectrogram shape concatenate linear mel weight matrix shape compute stabilized log get log magnitude mel scale spectrogram log mel spectrogram tf math log mel spectrogram print log mel spectrogram return log mel spectrogram path d tf data dataset list file wav mel d path d map load mel file info log include log source code would helpful diagnose problem including tracebacks please include full traceback large log file attached typeerror traceback recent call last build datasets train d build data pair dir train dir test d build data pair dir test dir build data pair dir source dir convert mel clean mel d clean path d map load mel file num parallel call autotune noisy mel d noisy path d map load mel file num parallel call autotune c user benhe conda envs homl2 lib site package tensorflow core python data ops dataset ops py map self map func num parallel call return datasetv1adapter parallelmapdataset self map func num parallel call preserve cardinality false deprecation deprecated none use tf data dataset map c user benhe conda envs homl2 lib site package tensorflow core python data ops dataset ops py init self input dataset map func num parallel call use inter op parallelism preserve cardinality use legacy function self transformation name dataset input dataset use legacy function use legacy function self num parallel call ops convert tensor num parallel call dtype dtypes int32 name num parallel call c user benhe conda envs homl2 lib site package tensorflow core python data ops dataset ops py init self func transformation name dataset input class input shape input type input structure add graph use legacy function defun kwargs resource tracker tracking resourcetracker tracking resource tracker scope resource tracker self function wrapper fn get concrete function internal add graph self function add graph ops get default graph c user benhe conda envs homl2 lib site package tensorflow core python eager function py get concrete function internal self args kwargs bypasses error checking getting graph function graph function self get concrete function internal garbage collected args kwargs returning concrete function someone may keep reference funcgraph without keeping reference c user benhe conda envs homl2 lib site package tensorflow core python eager function py get concrete function internal garbage collected self args kwargs self input signature args kwargs none none graph function self maybe define function args kwargs return graph function c user benhe conda envs homl2 lib site package tensorflow core python eager function py maybe define function self args kwargs graph function self function cache primary get cache key none graph function none graph function self create graph function args kwargs self function cache primary cache key graph function return graph function args kwargs c user benhe conda envs homl2 lib site package tensorflow core python eager function py create graph function self args kwargs override flat arg shape arg name arg name override flat arg shape override flat arg shape capture value self capture value self function attribute c user benhe conda envs homl2 lib site package tensorflow core python framework func graph py func graph py func name python func args kwargs signature func graph autograph autograph option add control dependency arg name op return value collection capture value override flat arg shape converted func func output python func func args func kwargs invariant func output contains tensors compositetensors c user benhe conda envs homl2 lib site package tensorflow core python data ops dataset ops py wrapper fn args attribute defun kwargs def wrapper fn args pylint disable missing docstring ret wrapper helper args ret structure tensor list self output structure ret return ops convert tensor ret c user benhe conda envs homl2 lib site package tensorflow core python data ops dataset ops py wrapper helper args nested args nested args ret autograph tf convert func ag ctx nested args func return list tensor nest flatten ops convert tensor would conspire attempt stack c user benhe conda envs homl2 lib site package tensorflow core python autograph impl api py wrapper args kwargs except exception e pylint disable broad except hasattr e ag error metadata raise e ag error metadata exception type e else raise typeerror converted code load mel file linear mel weight matrix tf signal linear mel weight matrix c user benhe conda envs homl2 lib site package tensorflow core python ops signal mel ops py linear mel weight matrix lower edge hertz upper edge hertz dtype c user benhe conda envs homl2 lib site package tensorflow core python ops signal mel ops py validate argument sample rate c user benhe conda envs homl2 lib site package tensorflow core python framework ops py bool raise typeerror using tf tensor python bool allowed typeerror using tf tensor python bool allowed use none instead test tensor defined use tensorflow ops tf cond execute subgraphs conditioned value tensor,2019-07-10 18:05:41,1562781941,resolved fixed,03ff87bfdeec43b9d3a208746ae19ebf9c139c14,1568668050,tensorflow\python\kernel_tests\signal\mel_ops_test.py tensorflow\python\ops\signal\mel_ops.py                                                          
166,30642,scatter_nd_update doesn't work with string,reproduced issue newest tensorflow official docker image written custom code opposed using stock example script provided tensorflow os platform distribution e g linux ubuntu ubuntu tensorflow installed source binary binary tensorflow version use command python version model need maintain extremely long variable tensor several column many row dtype string every training step need update several individual row tensor tf scatter nd update meet requirement perfectly except work string fact contrast tf scatter nd work since document mention string think may bug describe expected behavior hope tf scatter nd update support string ref really need feature project fixed quickly walk around suggestion include modify source code also welcome code reproduce issue import tensorflow tf ref tf variable qq ww ee rr index tf constant update tf constant aa dd cc bb update tf scatter nd update ref index update tf session sess sess run tf initialize variable print sess run update info log traceback recent call last file line file usr local lib python2 dist package tensorflow python client session py line run run metadata ptr file usr local lib python2 dist package tensorflow python client session py line run feed dict tensor option run metadata file usr local lib python2 dist package tensorflow python client session py line run run metadata file usr local lib python2 dist package tensorflow python client session py line call raise type e node def op message tensorflow python framework error impl invalidargumenterror opkernel registered support op scatterndupdate used node scatterndupdate defined attrs class loc variable use locking true tindices dt int32 dt string registered device cpu xla cpu registered kernel device cpu dt bool tindices dt int64 device cpu dt bool tindices dt int32 device cpu dt complex128 tindices dt int64 device cpu dt complex128 tindices dt int32 device cpu dt complex64 tindices dt int64 device cpu dt complex64 tindices dt int32 device cpu dt double tindices dt int64 device cpu dt double tindices dt int32 device cpu dt float tindices dt int64 device cpu dt float tindices dt int32 device cpu dt bfloat16 tindices dt int64 device cpu dt bfloat16 tindices dt int32 device cpu dt half tindices dt int64 device cpu dt half tindices dt int32 device cpu dt int8 tindices dt int64 device cpu dt int8 tindices dt int32 device cpu dt uint8 tindices dt int64 device cpu dt uint8 tindices dt int32 device cpu dt int16 tindices dt int64 device cpu dt int16 tindices dt int32 device cpu dt uint16 tindices dt int64 device cpu dt uint16 tindices dt int32 device cpu dt int32 tindices dt int64 device cpu dt int32 tindices dt int32 device cpu dt int64 tindices dt int64 device cpu dt int64 tindices dt int32 scatterndupdate,2019-07-12 11:12:52,1562929972,resolved fixed,c3e32b03e187fc2854c34add42ee3d1fe1f17628,1568403940,tensorflow\core\kernels\scatter_nd_op.cc tensorflow\python\kernel_tests\scatter_nd_ops_test.py                                                          
167,30685,`TensorArray` objects used as `Dataset.reduce` state lose inferred shapes,system information tensorflow version use command python version describe current behavior tensorarray object passed accumulator dataset reduce lose inferred shape subsequent call tensorarray concat return fully unknown shape describe expected behavior element shape tensorarray partially known consistent behavior equivalent tf loop code reproduce issue tf function def compute arr tf tensorarray tf float32 dynamic size true def body arr real logits tf random normal arr arr write tf cast tf int32 real logits return arr def cond arr return arr tf loop cond body arr c arr concat tf print tensortarray concat shape c shape rank c shape rank return c tf function def compute d arr tf tensorarray tf float32 dynamic size true def body state arr state real logits tf random normal arr arr write tf cast tf int32 real logits return arr en d tf data dataset range enumerate arr en d reduce arr body c arr concat tf print tensortarray concat shape c shape rank c shape rank return c print tf loop compute print print tf dataset reduce compute d tf loop tensortarray concat shape tensorshape none rank tf dataset reduce tensortarray concat shape tensorshape none rank none,2019-07-13 18:49:53,1563043793,resolved fixed,6cd69820a7ec68363647bf918d312b5d10e0e07a,1563922618,tensorflow\python\data\util\structure_test.py tensorflow\python\ops\tensor_array_ops.py                                                          
168,31596,TFLiteConverter fails with tf.gather when the params argument is a layer attribute,please make sure bug per github policy address code doc bug performance issue feature request build installation issue github tag bug template system information os platform distribution e g linux ubuntu linux ubuntu lts tensorflow installed source binary conda tensorflow version use command dev20190807 python version cuda cudnn version gpu model memory x tesla p100 pcie describe current behavior able convert savedmodel flatbuffer using tfliteconverter corresponding tf kera model contains layer tf gather op params argument come variable initialized build method said layer params argument locally defined variable using tf nn embedding lookup instead tf gather everything work perfectly fine also applies tf gather nd describe expected behavior expect tf gather work case params argument attribute tf kera layer layer case mentioned code reproduce issue wrote toy example reproduce issue might clearer description import numpy np import tensorflow tf print tf version class embedding tf kera layer layer def init self vocab size hidden size super embedding self init self vocab size vocab size self hidden size hidden size def build self input shape self shared weight self add weight weight shape self vocab size self hidden size dtype tf float32 initializer tf random normal initializer mean stddev self hidden size def call self input return tf nn embedding lookup self shared weight input return tf gather tf zero shape self vocab size self hidden size input return tf gather self shared weight input class simplemodel tf kera model def init self vocab size hidden size super simplemodel self init self embedding layer embedding vocab size hidden size tf function input signature tf tensorspec shape none dtype tf int64 name input def call self input return self embedding layer input vocab size hidden size building model model simplemodel vocab size hidden size input tf random uniform shape dtype tf int64 maxval model input exporting savedmodel saved model dir simple model tf saved model save model saved model dir tflite conversion converter tf lite tfliteconverter saved model saved model dir tflite model converter convert info log traceback recent call last file home michael conda envs tf20 bin toco protos line sys exit main file home michael conda envs tf20 lib python3 site package tensorflow core lite toco python toco protos py line main app run main execute argv sys argv unparsed file home michael conda envs tf20 lib python3 site package tensorflow core python platform app py line run run main main argv argv flag parser parse flag tolerate undef file home michael conda envs tf20 lib python3 site package absl app py line run run main main args file home michael conda envs tf20 lib python3 site package absl app py line run main sys exit main argv file home michael conda envs tf20 lib python3 site package tensorflow core lite toco python toco protos py line execute enable mlir converter exception placeholder statefulpartitionedcall args specied input array,2019-08-13 22:26:37,1565735197,resolved fixed,252e6183523d226e50137c06a101df0aa5d4d5d9,1577144913,tensorflow\python\keras\saving\metrics_serialization_test.py                                                            
169,31952,[TF 2.0] tf.gather doesn't work alongside @tf.function,please make sure bug per github policy address code doc bug performance issue feature request build installation issue github tag bug template system information written custom code opposed using stock example script provided tensorflow yes os platform distribution e g linux ubuntu darwin kernel version mobile device e g iphone pixel samsung galaxy issue happens mobile device n tensorflow installed source binary binary tensorflow version use command dev20190730 python version python anaconda inc bazel version compiling source n gcc compiler version compiling source n cuda cudnn version n gpu model memory n describe current behavior seems tf gather called tf function gradient calculated example code blow show bug code raise following error message assertionerror expected args tensors variables got compositetensor code work remove tf function decorator put tf gather line inside tf funtion graph code reproduce issue import numpy np import tensorflow tf x tf cast np random randn tf float32 z tf cast np random randn tf float32 layer tf kera layer dense tf function removing code work fine def fun x layer layer x return tf gradienttape tape fun x layer tf gather put line inside function work fine loss tf norm z grad tape gradient loss layer trainable variable,2019-08-25 09:51:25,1566726685,resolved fixed,d5ee347de231b55f8ef7c11402db1673ff111d53,1575328576,tensorflow\python\eager\backprop_test.py tensorflow\python\eager\function.py                                                          
170,32029,tensorflow.keras.Model.compute_output_shape gives wrong results,system information written custom code opposed using stock example script provided tensorflow yes os platform distribution e g linux ubuntu linux ubuntu tensorflow installed source binary conda tensorflow version use command tried python version describe current behavior using kera model stored variable mm tensorflow kera would like calculate output shape given input work correctly first time call mm compute output shape subsequent result calling function different shape inconsistent using standard kera method get different consistent result example problem implemented tf bug py script find zip call without parameter load fully convolutional model json file provided zip import json import tensorflow kera kera open model tf bug json r fi kk json load fi mm kera model model json json dump kk n range s n print s mm compute output shape input shape s result displaying input corresponding output shape line kept relevant line see first line correct starting input shape output shape decrease start produce erratic behavior fully convolutional model increase monotonously input size describe expected behavior running script argument kera us vanilla kera version case output shape increase expected note get correct result tf kera well clear model output shape cache compute output shape running script argument clear us modified loop follows n range s n len sys argv sys argv clear mm output shape cache clear print s mm compute output shape input shape s result correct expected looking function mm compute output shape found compared kera changed cache key generation kera cache key join str x x input shape tf kera cache key generic utils object list uid input shape appears cache key tf kera confuses different input shape return wrong result cache code reproduce issue find script model output file zip tf compute output shape bug zip,2019-08-28 00:13:46,1566951226,resolved fixed,3ba8bd697faf4b831f78c3fa547d7956f1b1a0aa,1582239182,tensorflow\python\keras\engine\network.py tensorflow\python\keras\engine\network_test.py tensorflow\python\keras\utils\generic_utils.py                                                        
171,32049,Creating a boolean constant prints a deprecation warning,system information written custom code yes os platform distribution ubuntu tensorflow installed binary tensorflow version python version describe current behavior creating boolean constant print deprecation warning w0828 deprecation py lib python3 site package tensorflow core python framework constant op py eagertensorbase cpu tensorflow python framework ops deprecated removed future version instructions updating use tf identity instead describe expected behavior deprecation warning code reproduce issue import tensorflow tf tf zero dtype tf bool,2019-08-28 13:57:06,1567000626,resolved fixed,8d4ecb0f24c4f9fc18c248838d2496b8410961f6,1567638466,tensorflow\python\framework\constant_op.py                                                            
172,32162,[lite doc] broken link in`TensorFlow Lite and TensorFlow operator compatibility`,link page broken,2019-09-03 03:21:37,1567480897,resolved fixed,50f0bb045ca2483c516938a867df806d12b6ee49,1568075796,tensorflow\lite\g3doc\guide\ops_compatibility.md                                                            
